PUBLISHER,TOTAL BOOKS,BOOK TITLES
Frank Bros & Co.,63,"Basic Mathematics,Basic Mathematics,Computer Science,Computer Science,Computer Science,Computer Science,Computer Science,Computer Science,Computer Scince,Concise Social science,Concise Social science,Endless Words: The Frank General Knowledge Series,Endless world : The frank General Knowledge Series,Endless Worlds : the franks GK. Series,Endless worlds? The Frank General Knowledge Series,Environmental Studies,Environmental Studies,Environmental Studies,Environmental Studies,Everyday Science,Frank Environmental Studies,Frank Primary Science,Frank World Geography,Fun with computer science,Grammar Express,Grammar Express,Joy of Engligh : A Course in literature,Joy of English : a Course in Literature and language,Joy of English : A course in literature and Langyage,Joy of English: A course in Literature and language,Joy of Mathe mathematics 5,Joy of Mathematics 6,Joy of Mathematics 8,Learn ''n'' Mathematics Tear Away Worksheets,Learn ''n'' Play Mathematics,Learning Mathematics,Mathematics,Mathematics,Middle Schoo"
Frank Educational Aids,43,"Around the world 5,CCE Edition Fun with Science,CCE Edition Fun with Science,Discover 5 A book of Social Studies,Exploring Horizone Environmental Studies,Exploring Horizons :  Environment Studies,Exploring Horizons : Environmental Studies,Fun with Science,Fun with Science,General Knowledge,General Knowledge,General Knowledge,General Knowledge: with a special info and activity packed pull out,General Knowledge: with a special info and activity packed pull out,Growing With Grammar,Growing With Grammar,Learning mathematics 7,Learning maths 5,Learning maths 6,Learning maths 8,Learning science,Let's enjoy mathematics 5,Madhurima : pathyapustak 5,Madhurima : pathyapustak 5,Madhurima : pathyapustak 6,Madhurima pathayapushtak 5,Madhurima pathaypustak 3,Magic lantern: an integrated course in english workbook, class 8,Magic lantern: an integrated course in english, class 7,Magic lantern: an integrated course in english, teachers book class 6,New Learning Science,New learning science 7,Pathways To Social Science,Pathway"
Frank Educationla Pvt. Ltd.,11,"Click on computers and applications,Click on computers and applications,Click on computers and applications,Click on computers and applications,Learning maths,Learning maths,Learning maths,Learning maths,Learning maths,Learning science,Madhurima : Pathyapustak 6"
Franks Bros. & Co.,3,"Frank CCE Primary Mathematics,Frenk CCE Environmental  Studies,Steps to Science"
Franksons,4,"Learning to intract in English,Learning to intract in English,Learning to intract in English,Learning to intract in English"
Full circle education pvt ltd,48,"Asignments in english plus 9 vol -1,Assignments English plus vol -2,Assignments in english plus 6,Assignments in english plus 7,Assignments in english plus8,BUSINESS STUDIES,CBSE Term 2 Social Science 10,CHEMISTRY,English language and literature 9,English plus language & literature 10 vol- 2,English plus language and literature 10 vol 1,Examguru Accontancy 12,Examguru english 9,Examguru English communicative 10,Examguru English communicative 10,Examguru Mathematics 10,Examguru Mathematics 9,Examguru Science 10,Examguru Science 9,Examguru Social Science 10,Examguru Social Science 10,Examguru Social science 9,General knowledge 5,General knowledge 7,General knowledge 8,General knowlegde,Great expectations,Gulmohar hindi pathaypushtak 5,Gulmohar hindi vyakaran 8,Hindi pathaypustak 9 (Gujarat board),MATHEMATICS,Nayi gulmohar : pathyapustak 6,Nayi Gulmohar 7,Nayi gulmohar hindi pathaypushtak 8,PHYSICS,Robinson crusoe,Sample Papers - Mathematics,Sample Papers - Science,SAMPLE PAPERS - SOCIAL SCIENCE,Solved Papers - "
Full Marks,11,"Amoli hindi pathmala 3,Amoli hindi pathmala 5,Amoli hindi pathmala 7,Amoli pathmala,Amoli pathmala 4,Examguru social science,Full marks science 8,Hindi vyakaran parichay: class 10, couse B,Hindi vyakaran parichay: class 9, couse B,Social science 10,Social Science 10"
Full Marks Pvt Ltd,40,"Amoli hindi pathmala 6,Amoli hindi vyakaran,Amoli hindi vyakaran 5,Amoli hindi vyakaran 6,CBSE Business studies term 2,CBSE Term 2 Accountancy 12,CBSE Term 2 Biology,CBSE Term 2 Chemistry sample papers,CBSE Term 2 Economics,CBSE Term 2 English,CBSE Term 2 English 10,CBSE Term 2 Mathematics (standard)10,CBSE Term 2 Mathematics 12,CBSE Term 2 sanskritam 10,CBSE Term 2 Science 10,examguru accountancy: prepare, practice, perform, class 12,Examguru CBSE Term 2,examguru english communicative: prepare, practice, perform, class 10,examguru english core, prepare, practice, perform, class 12,examguru mathematics prepare, practice, perform, class 10,examguru mathematics: prepare, practice, perform, class 12,examguru mathematics: prepare, practice, perform, class 9,examguru physics: prepare, practice, perform, class 12,Examguru Science term 1,examguru science: prepare, practice, perform, class 10,Examguru science: prepare, practice, perform, class 9,Hindi Course B: term 1, class 10,Nothing lasts forever,Science,Super 20 "
Full Marks Pvt. Ltd.,54,"Activities in Mathematics,Activities in Mathematics,Activity plus in mathematics,Activity plus in mathematics,Assignments in English Plus,Assigtnment in English plus: term 1, Class 6,Assigtnment in English plus: term 1, Class 8,Assigtnment in English plus: term 1, Class 9,Assigtnment in English plus: term 2, Class 10,Assigtnment in English plus: term 2, Class 8,Assigtnment in English plus: term 2, Class 9,English,English,English,English Communication: Term 1,English Communication: Term 2,English Communicative,English Core,Examguru english term 1-,Examguru Hindi term 1,Examguru Mathematics basic term 1,Examguru Mathematics standard term 1,Examguru sanskrutam term 1,Examguru Social Science term 1,Full marks 7,Hidni, Full Marks,Hidni, Full Marks,Hindi B, class 9,Invisible man,Mathematics: term 1, class 10,Mathematics: term 1, class 10,Mathematics: term 1, class 9,Mathematics: term 1, class 9,Open text based assessments,Practical Skills in Biology,Science,Science,Science,Science Term 1,Science Term 2,Social Scien"
Future books,10,"A gateway to modern science 6, gateway to modern science 8,Aromatic General knowledge,Essays and letters,Gyanodaya Pathyapustak,Gyanodaya Pathyapustak,Gyanodaya Pathyapustak,Gyanodaya Pathyapustak,Gyanodaya Pathyapustak,Gyanodaya Pathyapustak"
Future Kid Publication,57,"General Knowledge 3,General knowledge 4,General Knowledge 5,General knowledge 5,General knowledge 6,General knowledge 6,General Knowledge 7,General knowledge 7,General Knowledge 8,General knowledge 8,Go Grammar,Go grammar 6,Go grammar 6,Go grammar 7,Go Grammar 7,Go grammar 8,Gyanoday hindi pathaypushtak 7,Gyanoday pathaypustak,Gyanodaya 5,Gyanodaya hindi 7,Gyanodaya hindi pathayapustak 5,Gyanodaya hindi pathpushtak,Gyanodaya hindi pathpushtak,Magical Math 5,Magical Math 6,Magical Math 7,Magical Math 8,Magical mathematics,Magical mathematics 5,Magical mathematics 6,Magical mathematics 7,Magical mathematics 8,Math Power 6,Math Power 6,Math Power 7,Math Power 8,Math Power workbook 7,Math Power workbook 8,New approach  to science,New approach to science,New approach to science 6,New approach to Science 6,New approach to science 7,New approach to social science,New approach to social science 6,New approach to social science 7,New spproach to social science 6,Pearls :course book 7,Pearls :coursebook 6,Pearls :cours"
Future Kids Publication,23,"General Knowledge 5,Go Grammar,Go Grammar,Go Grammar,Go Grammar,Gyanoday : Pathyapustak 6,Gyanodaya 6,Harmony : A book on Social Studies,New approach to science 7,New approach to social science 7,New approach to social studies 5,Pearls :An integrated Course in English,Pearls :An integrated Course in English,Pearls :An integrated Course in English,Pearls An Integrated Course In English Coursebook,Pearls An Integrated Course In English Coursebook,Pearls An Integrated Coursebook,Pearls Main Course Book,Pearls: An Integrated Course in Engish,Ripples 6,Ripples main course book 7,Social science 8,Umang deepjyoti 5"
Future world publications,3,"A gateway to modern science 7,Aromatic GK 5,Aromatice GK"
G.  Ram Books,49,"A better you 1,A better you 10,A better you 2,A better you 3,A better you 4,A better you 5,A better you 6,A better you 6,A better you 7,A better you 7,A better you 8,A better you 8,A better you 9,Foundation of information theory,Grammar Candy,Grammar Candy 7,Infozone computer applications 9,Life ready,Life ready : nurturing vital life skills,values and ethics,Life ready :nurturing vital life skills,values and ethics,Life ready :value and ethics 4,Life ready 1,Life ready 3,Life ready 7,Life ready 7,Life ready 8,Makarand hindi pathaypushtak,Makarand hindi pathypushtak,Makrand : pathyapustak 6,Makrand hindi pathmala 7,Makrand Hindi Pathyapustak,Makrand Hindi Pathyapustak,Makrand Hindi Pathyapustak,Makrand hindi pathyapustak,Makrund hindi pathaypushatak 5,Maths wisdom,Maths wisdom 5,Maths wisdom 6,Maths wisdom 7,Maths wisdom 8,Maths world  6,Maths world 8,Science quest,Science quest 6,Science quest 6,Science quest 7,Science quest 7,Science quest 8,Science quest 8"
G. R. Bathla Publications,9,"New era biology: textbook for class 10,New era biology: textbook for class 9,New era chemistry: textbook for class 10,New era chemistry: textbook for class 9,New era physics textbook for class 10,New era physics textbook for class 9,New era science practical for class 10, term 1 & 2,New era science practical for class 9, term 1 & 2,New era science practical: term 1 and 2, class 9"
G. R. Bathla Publications Pvt. Ltd,4,"New era english communicative: course A, class 10,New era mathematics: class 9,New era physics: textbook for class 11, part-1,New era physics: textbook for class 11, part-2"
G. Ram Books,7,"Curiosity quotent,Curiosity quotent,Foundation of information theory,Infozone computer sciecne,Infozone computer sciecne,Infozone computer sciecne,Infozone computer sciecne"
G. Ram Books (P) Ltd.,11,"Grammar Candy,Maths wisdom 8,Maths wisdom: class 2,Maths wisdom: class 3,Maths world 7,Roli hindi pathmala: class 3,Roli hindi pathmala: class 4,Roli hindi pathmala: class 5,Roli hindi pathmala: class 6,Roli hindi pathmala: class 7,Roli hindi pathmala: class 8"
G.R.Bathla Pblication Pvt.Ltd.,25,"Advanced problems in Organic Chemistry, for JEE,Biology, science part-3,Biology, science part-3,Chemistry: part 1, class 11,Chemistry: part 1, class 12,Chemistry: part 2, class 11,Chemistry: part 2, class 12,New era biology 12,New era Biology part 2,New era chemistry part 1,New era chemistry part 2,New era chemistry part 2,New era physics part 1,New era physics part 2,New era physics part 2,Numerical Chemistry, for JEE,Physics: part 1, class 11,Physics: part 1, class 12,Physics: part 2, class 11,Physics: part 2, class 12,Science part-1 :Physics, Class 10,Science part-1 :Physics, Class 9,Science part-2 :Chemistry, Class 10,Science part-2 :Chemistry, Class 9,Scince Practical, Term1&2"
G.R.Bhatiya Publicationa,2,"Organic chemistry for chemistry:JEE,Organic chemistry for chemistry:JEE"
G.Ram Books,8,"GK,Makrand 5,Mathematics,Unified maths,Unified maths,Unified maths,Unified maths,Unified maths"
G.Ram Books P Ltd.,40,"Buiiding Bridge : A book of Values and Life Skill,Building Bridge : A book on values and life skills,Building Bridge: A book on values and life skill,Building bridges,Building bridges,Building bridges,Building Bridges : A book on values and life skill,Building Bridges : A book on values and life skills,Computer Activity Book,Computer Activity Book,Computer Activity Book,Computer Activity Books,Computer Activity Books,Digi Tech : A Gateway into the world of information Technology,DigiTech:  A gateway into the World of Information Technology,DigiTech:  A gateway into the World of Information Technology,DigiTech:  A gateway into the World of Information Technology,DigiTech:  A gateway into the World of Information Technology,DigiTech:  A gateway into the World of Information Technology,DigiTech:  A gateway into the World of Information Technology,DigiTech:  A gateway into the World of Information Technology,DigiTech: A gateway into the world of Information Technology,Experimenting with Maths,I. T. Genius,I. T. G"
G.Ram books private ltd,1,Foundation of information technology 10
Galgotia Book Source,4,"Computer In Schools,Computer in Schools,Computer in Schools,Computer in Schools"
Gautama Brothers,2,"Fragrance : Moral Science,Fragrance Moral Science"
Geeta Publishing House,38,"Best in business  studies 12 part A,Best in business studies 12,Best in business studies 12 part B,Best in English core 12,Best in mathematics 10,Best in Mathematics 10,Best in Mathematics 9,Elite high school english grammar and composition,English grammar and composition 6,English grammar and composition 6,English grammar and composition 7,Gyan sagar 1,Gyan sagar 7,Gyan sagar 8,Introductory Macroeconomics 12,Knowledge tree,Knowledge tree,Knowledge tree 4,Knowledge tree 5,Knowledge tree 6,Knowledge tree 7,Knowledge tree 8,Life skills and value education,Life skills and value education,Life skills and value education,Life skills and value education,Life skills and value education 1,Life skills and value education 2,Life skills and value education 2,Life skills and value education 3,Life skills and value education 5,Life skills and value education 8,Life skills in value education 7,Life skills value education,Mathematics 9,Spiral Maths 6,Spiral Maths 7,Spiral maths 8"
Genius Kids Publications,32,"English Grammar and Composition,Genius english grammar and composition: class 1,Genius english grammar and composition: class 2,Genius english grammar and composition: class 6,Genius Kidz : Mathematics 6,Genius kidz : Mathematics 8,Genius kidz Mathematics 7,Genius kidz pioneer: acreative english book, class 1,Genius kidz pioneer: acreative english book, class 2,Genius kidz pioneer: acreative english book, class 3,Genius kidz pioneer: acreative english book, class 4,Genius kidz pioneer: acreative english book, class 8,Genius Kidz Social Studies,Genius Kidz SOCIAL STUDIES,Genius Kidz Social Studies,Genius Kidz Social Studies,Mathematics 5,Morni hindi pathamala: class 1,Morni hindi pathamala: class 2,Morni hindi pathamala: class 3,Morni hindi pathamala: class 4,Morni hindi pathamala: class 5,Morni hindi pathamala: class 6,Morni hindi pathamala: class 7,Morni hindi pathamala: class 8,Science,Science 6,Science 8,Twist your brain 5,Twist your Brain 6,Twist your Brain 7,Twist your brain 8"
Global Publication Pvt. Ltd.,4,"Xam idea  science term-2,  class 9,Xam idea  science term-2,  class 9,xam idea Hidni-Course B,Xam idea science, Term-1"
Global Publications Pvt. Ltd.,15,"Introductory Macroeconomics,Introductory Macroeconomics,Introductory microeconomics and macroeconomics,Mathematics,Mathematics: Continuous and Comprehensive Evalution,Science,Science: Countinuos and Comprehensive Evalution,Science: Countinuos and Comprehensive Evalution,Science: Countinuos and Comprehensive Evalution,X am idea Accountancy,X am idea Chemistry,Xam idea Mathematics, Term-1,Xam idea social science term-2,  class 9,Xam idea social science, Term-1,Xam Idea: Mathematics"
Global Text Books,4,"Computer education: Information Communication and Technology (ICT)in Schools,Excellence in Computer Education,Excellence In Computer Education: Information Technology In Schools,Xam idea mathematics term 2, class 10"
Golden Minds publishing house,10,"Dappy dog learns to be honest,Develop self confidence improve public speaking,Freda fox learns to be friendly,Grenda Giraffe learns to love plants,Sammy Snail learns to be safe,Sherlock Holmes,Sherlock Holmes,Tell me about ?,Tell me how ?,Think and grow rich"
Golgotia Booksource,1,Maths the Easyway
Good Luck Publihers limited,20,"Basic English Grammar & Composition,Basic English Grammar & Composition,Basic English Grammar And Composition,Bhasha Mani Textbook,Bhashamani 5,Computer Era,Computer Era,Computer Era,Computer Era,Conquer English,Echoes of Tome Learning English,Learning English,My Favourite book of G.K with I Q test,My Favourite Book Of G.K. with I.Q. Tests,Our Green World,School Maths,Social science,Social Studies,Social Studies,Social Studies"
Good Luck Publishers Limited,20,"Basic English Grammar And Composition,Basic English Grammer And Composition,Bhasamani 6,Bhasha mani text cum workbook 8,Computer era next: class 1,Computer era next: class 2,Computer era next: class 3,Computer era next: class 4,Computer era next: class 5,Computer era next: class 6,Computer era next: class 7,Computer era next: class 8,Conquer english course book: class 6,Conquer english course book: class 7,English link: worksheet, class 10,New school maths: class 1,New school maths: class 2,New school maths: class 3,New school maths: class 5,New school maths: class 7"
Goyal Brother Prakashan,43,"A complete course in mathematics 10,A complete course in mathematics 9,A textbook of information technology 10,A textbook of information technology 9,CBSE Sample paper English 10,CBSE sample paper Information Technology 10,Exploring science 5,Gateway to science biology,Gateway to science chemistry 10,Gateway to sciene physics,General Knowledge 3,General knowledge times 4,General knowledge times 5,General knowledge times 6,General knowledge times 7,General knowledge times 8,Geography 10,Mathematics success 6,Mathematics Success 6,Mathematics success 7,Mathematics Success 7,Mathematics success 8,Mathematics Success 8,Mathematics Success part  A (1),Mathematics Success part 1,Mathematics Success part A(term 1),Maths Practice Book with mental mathematics,Political science,Science success,Science success 6,Science Success 6,Science success 7,Science Success 7,Science Success 7,Science success 8,Science Success 8,Science Success 8,Science Success 8,Social science 6,Social science 8,Social science History,Social Sci"
Goyal brothers Prakashan,57,"A text book of Social Science,A text book of Social Science,Composite Mathematics,Composite Mathematics,Core Economics,Creative English: A Complete course in english Based on the Eclectic Approach,Elementary English Grammar and composition,Elementary English Grammar and composition,Elementary English Grammar and composition,Elementary English Grammar and composition,Elementary English Grammar and composition,Elementary English Grammar and composition,Elementary English Grammar and composition,Elementary English Grammar and composition,Elementary science: A book of Science & Technology,Environmental Education,General Knowledge Times,General Knowledge Times,General Knowledge Times,General knowledge Times Plus Record Book,General Knowledge Times plus Record Book,Goyal''s assignments in english language & literature,Learning Elementary : A book of Science & Technology,Learning Elementary Science : A book of Science & technology,Mathematics Laboratory manual,Maths Practice Book mental mathematics,Maths Practice Bo"
Goyal Brothers Prakashan.,10,"Gullivers travels Term 1 & 2,Silas Marner: George Eliot,Story of my Life Term 1 & 2,The canterville ghost: Oscar Wilde,The canterville ghost: Oscar Wilde,The Diary of a Young Girl: Anne Frank Term 1 & 2,The Hound of the Baskervilles: Arthur convan Doyle,The story of my Life,Up From Slavery: Booker T.Washington,Up from slavery: Booker T.Washington"
Goyal Publisher limited,2,"Dictionary of Chemistry,Dictionary of Physics"
Grafalco,7,"Computer science,Computer science,Computer science,Computer science,Grafalco general knowledge path 3,Grafalco general knowledge path 5,Grafalco general knowledge path 5"
Grapevine India,2,"Greatest poetry ever written,World's greatest  short stories"
Green Earth,63,"Butterfly :coursebook 5,Enance our knowledge 7,Enhace our knoeweldge 7,Enhance our knowledge  3,Enhance our knowledge 3,Enhance our knowledge 3,Enhance our knowledge 3,Enhance our knowledge 5,Enhance our knowledge 5,Enhance our knowledge 5,Enhance our knowledge 5,Enhance our knowledge 5,Enhance our knowledge 5,Enhance our knowledge 6,Enhance our knowledge 6,Enhance our knowledge 6,Enhance our knowledge 6,Enhance our knowledge 6,Enhance our knowledge 7,Enhance our knowledge 7,Enhance our knowledge 8,Enhance our knowledge 8,Enhance our knowledge 8,Enhance our knowlegde 4,Enhance por knowledge 8,Growing with Grammar,Growing with Grammar,Growing with Grammar,Growing with Grammar,Growing with grammar 6,Growing with grammar 7,Growing with grammar 7,Growing with Grammar 7,Growing with Grammar 7,Growing with Grammar 8,Growing with grammar 8,know the world,know the world,Know the world 5,Know the world 7,Let''s plug in,Let''s plug in,Let''s plug in,Let''s plug in,Let's practice mathematics 6,New trands in social studi"
Green Earth Publication,9,"Enhance our knowledge  5,Enhance our knowledge 5,Enhance our knowledge 8,Growing with grammar 6,Practise mathematics 6,Practise mathematics 8,Vyom hindi vyakaran: class 3,Vyom hindi vyakaran: class 4,Vyom hindi vyakaran: class 4"
Green Earth Publications,31,"Enhance our knowledge 3,Enhance our knowledge 4,Let''s Know The World : General knowledge,Let''s Know the world: General Knowledge,Let''s Know the world: General Knowledge,Let''s Know the world: General Knowledge,Let''s Know the world: General Knowledge,Let''s Know the world: General Knowledge,Let''s Know the world: General Knowledge,Let''s Know the world: General Knowledge,Let''s Know the world: General Knowledge,Let''s Know the world: General Knowledge,Let''s Know the world: General Knowledge,Let''s Know the world: General Knowledge,Let''s Know the world: General Knowledge,Let''s Plug in : A Series of conmputer books,Let''s Plug in : A Series of conmputer books,Let''s Plug in : A Series of conmputer books,Let''s Plug in : A Series of conmputer books,Let''s Plug in : A Series of conmputer books,Let''s Plug in : A Series of conmputer books,Let''s Plug in : A Series of conmputer books,Let''s Plug in : A Series of conmputer books,Let''s Plug in : A Series of conmputer books,Let''s Plug in : A Series of conmpute"
Grolier book club edition,3,"Bark, spike, Bark,Disney's : the prince and the pauper,Walt disney's : the fox and the hound"
Grolier books,2,"Disney's aladdin,The wonderful world of knowledege Transport"
Grosset & Dunlap,7,"Nancy's mysterious letter,The Hardy boys : footprints under the window 12,The hardy boys :The hidden harbor mystery 14,The Hardy Boys :The Sinister Signpost 15,The Hardy boys: While the clock ticked 11,The hardy boys:the mark on the door 13,The secret of mirror bay"
Gujarat State Board of School Textbook,1,Chemistry Practical Record book
Gur Das Kapur & Sons P Ltd.,1,Fast Track: The Next Generation Computer Series
Gur Das Kapur & Sons P.Ltd,3,"Fastrack: The new Generation Computer Series,Test your Knowledge,Test your Knowledge : A book of general Knowledge & I.Q. Test"
Gur Das Kapur & Sons P.Ltd.,1,Fastract: The next Generation computer series
Gurukul Publications,12,"36 series CBSE paper bank 2020 examination,36 series paper bank 2020 examination,36 series paper bank 2020 examination,36 series paper bank 2020 examination,CBSE 15 practice papers,CBSE Chapterwise objective mcqs 10,CBSE Chapterwise objective mcqs 12,CBSE Complete Course Hindi- A,CBSE COMPLETE COURSE HINDI-A,Chapterwise last years solved papers 2021examination,Grammar time,Grammar time"
Hachette book publishing,36,"Adam Bede,Bhagvat Gita,Daniel Deronda,Felix holt,the radical,Grandma's of stories,Here's the Naughtiest girl,Northanger Abbey,On the hisotry of the world this in 366 days day,Outside the gates of the world:selected short stories,Round the clock,Second form Malory Towers,Silas Marner :the lifted veil,brother jacob,Summer stories,Taranauts : The quest for the shyn emeralds,Taranauts :the key to the Shimr Gitrines,Taranauts: the mystery of the syntilla silvers,Taranauts: the race for the glo rubies,Taranauts: the riddle of the lustr sapphires,Taranauts: the secret of the sparkl amethysts,Taranauts:the magic of the Dazl Corals,Taranauts:the search for the Glytr Turquoises,The famous five,The famous five other stories,The famous five other stories,The famous five other stories,The famous five: five get into trouble,The fly away cottage and other stories,The magic of the dazl corals,The mystery of the secret room,The Secret Seven,The secret seven :secret seven adventure 2,The secret seven :secret seven on the trail"
Hachette children books ;Hodder,6,"The naughtiest girl again 2,The naughtiest girl in the school 1,The naughtiest girl is a monitor- 3,The naughtiest girl keeps secret -5,The naughtiest girl marches on -10,The naughtiest girl saves the day -7"
Harbour Press,14,"Additional practice mathematics 6,Additional practice mathematics 6,Additional practice mathematics 7,Additional practice mathematics 8,Additional practice mathematics 8,Additional practice science,Additional practice science 6,Grammar cloud 6,Grammar cloud 7,Grammar cloud 8,Mathematics: Additional Practice 8,Social Science 10,Vyakaran Taru 10,Vyakaran taru 9"
Harbour Press INTERNATIONAL,1,Additional practice : mathematics 7
