PUBLISHER,TOTAL BOOKS,BOOK TITLES
Pearson,43,"Active teach universal science 6,Climb with cornerstone 6,Climb with cornerstone 7,Climb with cornerstone 8,Know and grow with Derek,Know and grow with derek  6,Know and grow with derek  7,Know and grow with derek 3,Know and grow with Derek 3,Know and grow with Derek 4,Know and grow with Derek 5,Know and grow with Derek 6,Know and grow with Derek 8,Longman new images :coursebook 7,Maths ace 5,Maths Ace 6,My Canvas,My Canvas,My canvas 3,My Canvas Coursebook,My Canvas Coursebook,My Canvas Literature Reader,My Canvas Literature reader,My Canvas Literature Reader,New images : a ccmprehensive english course 5,New Images : literature reader 5,New images : literature reader 7,New Images :coursebook 6,New Images :coursebook 8,New images :reader 6,New images:literature reader 8,New Longman Vistas 6,New longman vistas 7,New longman vistas 8,Tune in to grammar fine tune your language: class 1,Tune in to grammar fine tune your language: class 2,Tune in to grammar fine tune your language: class 3,Tune in to grammar fine t"
Pearson Education,21,"A Beautiful Life : Value Education & Life Skill,A Beautiful life Value Education & Life Skill,Active teach maths ace 8,EarthWorks Environmental Studies,Expanded Universal Science 6,Images : A Comprehensive course in english,Know and Grow with Derek,Know and grow with derek,Know and grow with Derek 5,Longman Science Quest,Lonman Maths,Maths ACE 8,Maths ace prime 5,Maths Ace prime 7,My canvas :coursebook 6,New Images : coursebook 5,New Seasons : A Course in communicative english,New Seasons : A Course in communicative english,Try Out ! : A book of math lab Activities and mental math,Try Out ! : A Book of mathslab Actvities and Mental math,Universal Science"
Pearson India Education Services Pvt Ltd,2,"Active teach : maths ace 7,Active teach : my canvas 8"
Pearson Longman,27,"A Beautiful Life,A look at life,Active Maths,Active Maths,Celebrate : An Activity based Multi skills Course In English,Celebrate : An Activity Multi skills Course in English,Celebrate :An Activity based multi skill course in english,Derek''o Brinen''s General Knowledge for class 1,Earthworks  Environmental Studies,Images : a Comprehensive course in English,Images: A comprehensive course in English,Images: A comprehensive course in English,Know and grow with derek,Know and Grow with Derek,Know and grow with derek,Let''s log in Anew,Let''s Log In Anew!,Let''s Log In Anew!,New Seasons : A course in Communicative english,New Seasons : A Course in communicative english,New Seasons: A course of Communicative English,New Seasons: A course of Communicative English,Science Quest Primary Science,Social Science : Histotry Geograpgy and Civics,Social Science: History, Geography, and Civics,Try Out : A book of math lab Activities and mental math,Universal Science"
Pearson Publication,3,"Chemistry: IIT foundation series, class 9,Mathematics: IIT foundation series, class 9,Physics: IIT foundation series, class 9"
Peason Longman,4,"Brainwave: General Knowledge,New Seasons : A Course in communicative english,New Seasons : A course in Communicative english,New Seasons : A course in Communicative english"
Penguin Books,48,"A killer in Kailash,Atomic Habits,Casino Royale,Chanakya and the art of war,Crazy times with uncle ken,Diamonds are forever,Doctor no,Dollar bahu,Exam Warriors,Exam Warriors,Exam Warriors,Exam Warriors,For your eyes only,Gently falls the bakula,Goldfinger,House of cards,Humble Pi,Ignited Minds,Inner engineering,Jeeves and the king of clubs,Landour days  :a writer's journal,Love among the bookshelves,Mahashweta,Octopussy,On her majesty's secret service,Origin story,Something happened on the way to heaven,Tess of the D'Urbervilles,The compelete adventures of Feluda,The day I stopped drinking milk,The doctor and the saint,The fault in our stars,The Giraffe and the pelly and me,The God of small things,The Inheritors stories of enterpreneurship and success,The magic finger,The man who became KHALI,The man with the golden gun,The mother i never knew,The power of your subconscious,The puffin book of classic school stories,The witches,Three thousand stitches,Thunderball,Till the clouds roll by beginnig again,Trouble "
Penguin Books India Pvt.Ltd.,3,"G K with Derek: The ultimate general knowledge & quiz Compendium,Imaging India : Idea for the century,The book of ram"
Penguin India,5,"Best of Ruskin Bond,Business legends,Ignited minds,India 2020,Rabindranath Tagore"
Penguin Random House UK,1,Who moved my cheese?
Perfect Publication,1,Drawn of a new : Vibrant India
Periwinkle  Books,44," Environmental  Studies,Computer @ School,Computer @ School,Computer @ School,Computer@ School,Computer@School,Computer@School,Computer@School,Computers@ School,English,English Grammar & Composition,English grammar & composition 6,Enviromental studies,General Knowledge,General Knowledge,General Knowledge,General Knowledge,General Knowledge,General Knowledge,General Knowledge,General Knowledge,General Knowledge,Let's Discover History,Let's Discover History,Let's Discover History,Let's Discover Social And Ploitical Life,Let's Discover Social And Political Life,Let's Discover Social And Political Life,Nalini : Pathmala 6,Nalini hindi pathmala,Nalini hindi pathmala 7,Now you know 6,Now you know 8,Periwinkle English 7,Periwinkle English Grammar & Composition,Periwinkle English Grammar & Composition,Periwinkle Environmental Studies,Periwinkle Environmental Studies,Periwinkle General Knowledge,Periwinkle General Knowledge,Periwinkle General Knowledge : An Environmental Approach,Periwinkle General Science : An Enviro"
PHI Learning Private Limited,3,"A Practical Course for Developing Writing Skills in English,A practical course in Effective english speaking skills,A practical course in Spoken english with CD"
Phoenix,1,I am Malala: girl who stood up for education and was shot by the Taliban
Pigeon books,1,George Washington :a biography
Pineworld Learning Solutions Pvt. Ltd.,9,"`The salt in life 8,The salt in life 3,The salt in life 4,The salt in life 5,Wow an activity based general knowledge: class 1,Wow an activity based general knowledge: class 2,Wow an activity based general knowledge: class 3,Wow an activity based general knowledge: class 4,Wow an activity based general knowledge: class 6"
Pinky book distributor,2,"Gullivers travel,Little Women"
Pinnacle Books Pvt.Ltd.,3,"First Illustrted Dictionary,First Illustrted Dictionary,Grammar In Action"
Pitamber Publishing Company Pvt. Ltd.,40,"Empoering Mental Math,Empowering Mathematics,Empowering Mental Math,Empowering Mental Math,Empowering Mental Math,Empowering Mental Math,Empowering Mental Math,Empowering Mental Math,Empowering Mental maths,Empowering Mental maths ; practice book 6,Empowering mental maths 7,Empowering Science,Empowering Science,Empowering Science,Empowering Science,Empowering science  7,Empowering science 6,Empowering science with Environment Education,Empowering science with Environment Education,Empowering Science with Environment Education,Empowering Science With Environmental Education,Empowering social science 5,Fandamentals of Biology,Fundamentals of National Income Accounting,Fundamentals of National Income Accounting,Gulliver Travels: Jonathan Swift,Jen austen''s Pride and Prejudies,Jen austen''s Pride and Prejudies,Learning Computer,Learning Computers,Mathematics,Mental math cum practice book 8,Mental Mathematics : Work book and Test Papers,New learning composite mathematics 5,Numericals in Physics,Principles of Fuct"
Plata Publishing,2,"Rich dad poor dad,Rich dad poor dad"
PM Publisher Pvt. Ltd.,9,"Diary of a young girl,Gulliver''s travels-1,Gulliver''s travels-2,Invisible man,My bits and bytes; computer series,Silas marner,Story of my life,Three men in a boat,Up from slavery"
Pocket Books,2,"Bear Snores on,Mrs McTats and her houseful of cats"
Prachi Educational Publishers,20,"Bhasha Setu Hindi Pathyapustak,English Grammar,English grammar 6,English Grammar 7,Environmental Studies,Excellence in english,Excellence in Mathematics : A Complete Textbook,Excellence in Mathematics : A Complete Textbook,Excellence in Mathematics 6,Excellence in mathematics 7,Excellence in mathematics 8,Excellence in Social Studies,Excellence in Social Studies: Based on the latest syllabus,Excellence mathematics 5,Saransh hindi ki pathaypushtak 7,Saransh hindi ki pathaypushtak 8,Science 6,Science Life today,Social science 8,Social science lab manual"
Prachi India Pvt. Ltd.,26,"Bhasha Setu : Pathyapustak 6,Excellence in Mathematics,Excellence in Mathematics,Excellence in Mathematics,Excellence in Mathematics,Excellence in Mathematics,Excellence in Mathematics,Excellence in mathematics 5,Excellence in Mathematics 6,Excellence in Mathematics 8,Excellence in social science 6,Excellence Social Studies: Based on the Latest Syllabus,Map Reflection,N ew Dimensions in Mathematics,New Dimensions in Mathematics,New edgeways : multiskill english 8,New edgeways 6,Saransh : pathyapustak 5,Saransh : Pathyapustak 6,Saransh hindi pathaypushak 5,Science,Science class 7,Science Practice Book with Lab Activity,Science Practice Book with Lab Activity,Science: Practice Book with Lab Activity,Vision in ICT Education"
Prachi India Pvt.Ltd.,36," Atlas: Map Reflection, Atlas: Map Reflection, Atlas: Map Reflection, Atlas: Map Reflection,Biology with Environmental Science,Environmental Studies,Excellence in english,Excellence in english,Excellence in english,Excellence in Mathematics,Excellence in Mathematics,Excellence in mathematics 7,Excellence in Mathematics: Based on the latest CBSE Syllabus,Excellence in social science 7,Excellence Social Studies,Formative and Summative Assessment approach in science: Chemistry,Health and Physical Education,Let''s Learn english,Map Reflection,Master Stroke : A step drawing series,Netctar Drops: A book on value education & social harmony,Netctar Drops: A book on value education & social harmony,Netctar Drops: A book on value education & social harmony,Netctar Drops: A book on value education & social harmony,Netctar Drops: A book on value education & social harmony,New Demensions in Mathematics,New Demensions in Mathematics,New Dimensions in Mathematics,Physics,Science,Science Experiments,Science Experiments,Socia"
Prachi Publications,2,"Science 8,Vision in ICT Education: Information and Communication Technology in Schools"
Prachi Pvt. Ltd,1,Health and physical education
Prachi Pvt. Ltd.,18,"Browse the world,Browse the world,Excellence in mathematics,Excellence in mathematics,Excellence in mathematics,Excellence in mathematics,Excellence in mathematics,Excellence in mathematics,Excellence in social studies,Nectar drops,Nectar drops,Nectar drops,Practical approach in chemisry,Practical approach in chemisry,Practical approach in physics,Science,Social Science,Wisdom tree"
Pradeep Publication,26,"Fundamental mathematics 10,Fundamental mathematics 9,Fundamental Physics vol .1 12,Fundamental physics vol 2 12,Fundamental Physics vol.2,New course chemistry vol. 2,New course chemistry vol.1,Objective Chemistry Vol.1 For Jee and jee Advanced,Objective Chemistry Vol.2 For Jee and jee Advanced,Pradeep's chemistry vol.1,Pradeep's chemistry vol.2,Pradeep's fundamental mathematics,Pradeep's Fundamental physics,Pradeep's fundamental physics vol 1,Pradeep's fundamental physics vol 2,Pradeep's new course Chemistry vol.1 11,Pradeep's new course Chemistry vol.2 11,Pradeep's science 10,Pradeep's science biology,Pradeep's science biology,Pradeep's science biology 10,Pradeep's science chemistry,Pradeep's science chemistry,Pradeep's science physics,Pradeep's science physics 10,Pradeep's science physics 9"
Pradeep publications,19,"Chemistry,Chemistry,Fundamental Physics,Fundamental Physics vol . 1, class 11,Fundamental Physics vol 2, class 11,New chemistry chemistry with value based questions, 13th ed.,  Vol.1,New chemistry chemistry with value based questions, 13th ed.,  Vol.2,New cource Chemistry vol . 1, class 12,New cource Chemistry vol .2, class 12,Pradeep''s A textbook of Biology .vol 1 class 11,Pradeep''s A textbook of Biology .vol 1 class 11,Pradeep''s A textbook of Biology 12,Pradeep''s funadamental mathematics,Pradeep''s funadamental physics vol.1 class 11,Pradeep''s funadamental physics vol.1 class 11,Pradeep''s new cource chemistry, Vol.1,Pradeep''s new cource chemistry, Vol.2,Pradeep''s new course Chemistry vol.1,Pradeep''s new course Chemistry vol.1"
Prakashan Pvt.Ltd.,2,"Focus on Social Sciences,Milestone in English : Main Course book"
Prentice Hall,1,Management information system: managinf th digital firm
Prentice Hall of India,1,Textbook of computer science
Pristine education (p)ltd,29,"Compact science 6,Compact science 7,Compact Science 8,Knowledege cafe 8,Knowledge cafe,Knowledge cafe,Knowledge cafe 7,Map Booster 10,Mathematices,Science,Science,Scorewell in English Communicative 10,Scorewell in English Communicative 10,Scorewell in Hindi course B 10,Scorewell in Hindi course B 10,Scorewell in Hindi course B 9,Scorewell in Hindi course B 9,Scorewell in Mathematics 10,Scorewell in Mathematics 10,Scorewell in Mathematics 9,Scorewell in Mathematics 9,Scorewell in mathematics 9,Scorewell in science 10,Scorewell in Science 10,Scorewell in Science 10,Scorewell in Social Science 10,Scorewell in Social Science 10,Scorewell in Social Science 9,Scorewell in Social Science 9"
Progress Publishers,2,"The Road to life,The Road to life"
Pruquest learning,6,"English : a communicative integrated-skill course 8,English : literature reader 8,English literature reader,English literature reader 5,English literature reader 6,Science class 7th"
Puffin Books,69,"An identity card for Krishna,Boy tales of childhood,Charlie and the chocolate factory,Charlie and the great glass elevator,Charlie and the great glass elevator,Cricket for the crocodile,Curious tales from the Himalayas,Curious tales from the Himalayas,Curious tales from the Himalayas,Danny the champion of the world,Danny the champion of the world,Diary of a wimpy kid,Diary of a wimpy kid :double down,Diary of a Wimpy Kid old school,Diary of a Wimpy kid: cabin fever,Diary of a wimpy kid: the third wheel,Esio Trot,Fantastic Mr.fox,Favorite Puzzles,Favorite Puzzles,Favorite Puzzles,Fun in devlok kama vs yama,George's marvellous medicine,James and the giant peach,James and the giant peach,Kashmiri story teller,Looking for the rainbow,Lori's magical mystery,Malgudi Adventures;classic tales for children,Malgudi school days,Matilda,Oliver and Amanda,Percy Jackson and the battle of the labyrinth 4,Percy Jackson and the last olympian  5,Percy Jackson and the lighting thief 1,Percy Jackson and the sea of monsters 2,Per"
Quercus,1,Human body : a visual guide to human anatomy
Quintessence book,1,1001 days the shaped world
Rachana Sagar,20,"CBSE Previous 10 years chapterwise solved question bank 10,Enriched Scanner Physics 12,Mathematics workbook : Practice material 6,Mathematics workbook : practice material 6,Mathematics workbook cum practice book 8,Mathematics workbook cum practice material 8,Science workbook cum practice book 6,Science workbook cum practice material 7,Science workbook cum practice material 8,Together with : objective type questions 10,Together with biology 12,Together with english communicative with solution: term 2, class 10,Together with english communicative with solution: term 2, class 9,Together with english communicative: term 2, class 9,Together with english core  12,Together with hindi B  with solution: term 2, class 10,Together with hindi B  with solution: term 2, class 9,Together with mathematics 5,Together with novels the diary of a young girl and the story of my life: term 2, class 10,Together with social science with solution: term 2, class 10"
Rachna Sagar,35,"CBSE Sample Papers English Core,English core pull out worksheets 11,Enriched scanner physics 12,Mathematics 7,Mathematics Buzz !!,Mathematics workbook cum practice material 6,New mathematics 6,Science workbook cum practice book 6,Science workbook cum practice material,Social Science 10,Social Science 10,Sunahari Dhup 5,Sunahri Dhoop Pathyapustak,Sunhari doop 3,Together with CBSE Sample papers 12,Together with CCE in social science,Together with english,TOGETHER WITH ENGLISH CORE,Together With English Core Assignments,Together With English Core Solution,Together With English Core Solutions,Together with mathematics 12,Together with sanskritam sampreshanatmak uttarsahitam: term 1, class 10,Together with sanskritam sampreshanatmak uttarsahitam: term 1, class 10,Together with sanskritam sampreshanatmak uttarsahitam: term 1, class 9,Together with sanskritam sampreshanatmak uttarsahitam: term 1, class 9,Together with sanskritam sampreshanatmak uttarsahitam: term 2, class 10,Together with sanskritam sampreshanatmak "
Rachna Sagar Pvt. Ltd.,31,"Mathematics workbook cum-practice material 7,New mathematics 8,Project work: Accountancy and Business study,Sample papers : Economics,Sample papers : English cimmunicative, term 2, class 10,Sample papers : Hindi B, term 2,Sample papers : Mathematics,Sample papers : Physics,Science workbook : practice material 7,Sunehri dhup : pathyapustak 5,Textbook of Mathematics, term 1,Class 10,Textbook of Mathematics, term 2,Class 10,Textbook of Mathematics, term 2,Class 9,Together with : objective type questions,Together with Economics with solution: support material for CBSE examination 2016,Together with English communicative solution , term 2, Class 10,Together with English communicative solution , term 2, Class 9,Together with English communicative, term 2 ,Class 10,Together with English communicative, term 2 ,Class 9,Together with Hindi B with solution, term 2: for CBSE examination 2016,Together with MAthematicss with solution: support material for CBSE examination 2016,Together with Mathematis with solution, term 2"
Rachna Sagar PVT.Ltd.,74,"Accountancy,Art,Evolutions We and the world Social Science,Evolutions we and thee world Social Science,Lab Kit includes formative tools : Science,Lab Kit Science,Lab Manual : Chemistry,Lab Manual Science,Mathematics Lab Kit : Includes Formative Tools,Mathematics Laboratory manual,Mathematics with solution : Based on latest syllabus,Mathematics: Laboratory Manual,Mathematics: Sample Papers,My big book of values,New exploring Computer,New Exploring Computers,New Exploring Computers,New Exploring Computers,New Exploring Computers,New Exploring Computers,New Exploring Computers,Nine plus one Sample papers English Core,Scanner science,Science Lab Skills,Science wirh Xtra Innings,Science: Multiple choice Questions,Science: Multiple choice Questions,Shrusti sanskrit vyakaan,Social Studies,Together with  English core : support material for CBSE examination 2016,Together with  English core solution: support material for CBSE examination 2016,Together with cbse nine plus one cce sample papers : Science Term-1,Together "
Rajpal and sons,2,"Jalte bujhte log (hindi),Khamoshi ke anchal me (hindi )"
Ramakrishna Mission,1,Awakening India
Ramsheela books,5,"Browser : a book of GK,Browser :book of general knowledge 5,Browser :book of general knowledge 6,Browser general knowledge 7,Browser general knowledge 8"
Random House India,20,"Astrosaurs : the claws of christmas,Astrosaurs :the skies of fear,Astrosaurs :the space ghosts,Astrosaurs: free collector cards inside,Astrosaurs: revenge of the fang,Astrosaurs: the dreams of dread,Astrosaurs: the forest of evil,Astrosaurs: the hatching horror,Astrosaurs: the twist of time,Astrosaurs:contest carnage,Astrosaurs:day of the Dino-droids,Astrosaurs:destination danger,Astrosaurs:earth attack,Astrosaurs:riddle of the Raptors,Astrosaurs:the mind sawp menace,Collected Stories,Fasting Feasting,IIM Ahmedabad: Managers who make a difference,It's my Party !,Knowledge encyclopedia :ultimate resource to discover the world"
Rastogi Publications,21,"A text book of Mathematics,A text book of Mathematics,A textbook of mathematics vol.2,Concept of biology,Concept of biology,Learning Sciece: Biology, class 10,Learning Sciece: Biology, class 9,Learning Sciece: Chemistry, class 10,Learning Sciece: Chemistry, class 9,Learning Sciece: Physics, class 10,Learning Sciece: Physics, class 9,Mathematics,Mathematics,Mathematics, class 10,Mathematics,class 12,Text book of mathematics,Text book of mathematics,Text book of mathematics,Text book of mathematics, 8th ed.,Text book of mathematics, 9th ed.,Text book of mathematics, 9th ed."
"Rastogi Publications, New Delhi",1,"Text book of mathematics, Volume.1,  8th ed."
Ratna  Sagar,78,"Atlas primary section,Communicate in english 5,Communicate in english 6,Communicate in english 7,Communicate in english 8,Computer magic,Computer magic,Computer magic,Computer magic,English grammar 6,English language and literature  9,Foundation of information theory,General Knowledge now,GK Magic,GK Magic,GK Now,GK Now 4,GK with art and craft 5,Grammar and more 6,Grammar and more 7,Grammar and more 8,Grammar plus 5,Integrated social science 6,Integrated social science 7,Integrated social science 7,Integrated social science 7,Integrated social science 8,Integrated social science\6,Integrated social sience 8,Living english,Living english 10,Living english 5,Living english 6,Living english 6,Living english 7,Living english 9,Living science,Living science 6,Living science 6,Living science 6,Living science 6,Living science 7,Living science 7,Living science 7,Living Science 8,Living science 8,Living science 8,Living science Biology 10,Living science biology 9,Living Science chemistry 10,Living Science physics 10,L"
Ratna Sagar,21,"  G K magic,English language and literature 10,Grammer plus: class 2,Integrated social science 8,My Big Book Of Social Studies,New communicate in english: an activity based integrated skill course, class 2,New grammar plus 8,Number magic: a textbook of mathematics, class 1,Number magic: a textbook of mathematics, class 2,Number magic: a textbook of mathematics, class 5,Number magic: a textbook of mathematics, class 6,Number magic: a textbook of mathematics, class 7,Number magic: a textbook of mathematics, class 8,Super computer based on window 7 and ms office 2010: class 3,Super computer based on window 7 and ms office 2010: class 4,Super computer based on window 7 and ms office 2010: class 5,Super computer based on window 7 and ms office 2010: class 6,Super computer based on window 7 and ms office 2010: class 7,Super computer based on window 7 and ms office 2010: class 8,Yes we can 4,Yes we can 6"
Ratna Sagar Pvt. Ltd.,116,"Accountancy: Accounting for partnership firms and companies,Accountancy: Accounting for partnership firms and companies,Communicate in English,Communicate in English,Communicate in English,Communicate in english,Communicate in English,Communicate in English,Communicate in English,Communicate in English: Acourse an activity based integrated skills course,Communicate in english: an Activity Book,Communicative English,Communicative in english,Communicative in English,Communicative in English,Communicative in english : An activity based integrated skill course,Communicative in english : An activity based integrated skill course,Communicativein English: An activity Based Integrated Skill Course,G K Genius,Grammar Plus,Grammar Plus : With Composition,Grammar Plus with Composition,Grammar Plus with Composition,Gulliver Travels: Into several remote nations of the world,Integrated Social Science,Integrated Social science,Integrated Social Science,Integrated Social Science: History, Geography and Social and Political L"
Rebo Publishers,1,100 wonders of the world : the finest treasures of civilization and nature on five continents
Red Fox,5,"Magic tree house :  eve emperor of the penguin,Magic tree house : Pirates treasure !,Magic tree house : The knight at dawn,Magic tree house :adventure on the amazon,Magic tree House :valley of the dinosaurs"
Reliable Enterprises,6,"Problem Solving assessment,Question bank -mathematics,Question Bank in Science,Question Bank in Science,Question Bank on Science,Question Bank on Social Science"
Resonance educating for better tommorrow,3,"Chemistry:organic chemistry JEE(mains+advanced) vol  2,class 12,Mathematics: integral calculus JEE(mains+advanced),class 12,Physics: mechanics  JEE(mains+advanced) vol 2 ,class 12"
Ripley Entertainment,1,Ripley''s Believe It or Not
Rising Sun Publishing Com,27,"Empowering  Environment Studies: Work book,Empowering Environmental Studies,Empowering Environmental Studies,Kaleidoscope: General Knowlede,Life Skills and Mental Ability,Kaleidoscope: General Knowlede,Life Skills and Mental Ability,Kaleidoscope: General Knowlede,Life Skills and Mental Ability,Kaleidoscope: General Knowlede,Life Skills and Mental Ability,Kaleidoscope: General Knowlede,Life Skills and Mental Ability,Practical Biology,Sea of stories : an anthology,Tana Bana,Tana Bana,Tana Bana 1,Tana Bana 2,Tana bana 2,Tana bana 3,Tana Bana 4,Tana bana 5,Tana Bana 5,Tana Bana 6,Tana Bana 7,Tana Bana 8,The Diary of a Young Girl: Anne Frank,The Hound of the Baskervilles: Arthur convan Doyle,Tresure trove,Tresure trove,Tresure trove"
Robin International,5,"Insight Computer,Insight Computer : A Journey Towards the Power of Computer,Insight Computer : A Journey towards the world of computer,Insight Computer : A journey Towards the World of Comuter,Insigt Computer: A journey Towards the world of Computer"
Rohan Book Company,5,"Bible (Hindi),Book of quotations,Book of synonyms & antonyms,Sanskrit Vyakaran,World''s great Scientist"
Rohit Publication,5,"Biology: Sample papers and Practice Papers,CBSE Question bank sample Papers and practical Papers: Physical Education,Sample papers: Social Science, term -2, class 10,Science: Sample Papers and Practical papers,Science: Sample Papers and Practical papers"
