PUBLISHER,TOTAL BOOKS,BOOK TITLES
 VK Global Publication Pvt. Ltd.,7,"Business studies,Business studies,Indian economic development,Introductory Macroeconomics,Introductory Microeconomics,Statistics for economics,Thinkeractive science workbook 8"
-,322,"1001 questions and answers,1984,21 Anmol kahaniya,21 lessons for the 21st century,365 stories Aroun the world,A masterpiece of essays 3,A masterpiece of grapghs IELTS,A new friend for mouse,A painted House,Abhivyakati hindi pathayapustak 5,Abhivyakati hindi pathaypushtak 7,Abhivyakti : Pathyapustak 6,Abhivyakti hindi pathaypushtak,Active Social Studies,Additional Practice Mathematics,Additional Practice Science,Adept English Grammar,Adept English Grammar,Adept English Grammar,Adept English Grammar,Alexander the great :a biography,Amelia Jane gets into Trouble,Amelia jane naughty again,An enterainment for angels,Ask an Astronaut,Astronomy: selected topics,Beauty and the beast,Billion & billions,Biology MCQ 12,Biology NEET Booster 11,Body language and the first line manager,Brainwave 7,Brainwave 8,Brainwave: a book of general knowledge 6,Breaking down,Browser general knowledge,BUSINESS STUDIES MODEL TEST PAPERS,Caves,CBSE SAMPLE PAPERS - ECONOMICS,CBSE Sample Papers Business Studies,CBSE Sample Papers English,C"
Aakash Institute,2,"Success magnet for JEE advanced 2016: Chemistry part 1,Success magnet for JEE advanced 2016: Chemistry part 2"
ACE Books,30,"Brain Booster,Brain Booster,Brain Booster,Brain Booster,Brain Booster,Brain Booster,Brain Booster,Brain Booster,Brain booster,Brain booster,Brain booster,Brain booster,Compu Kid,Compu Kid,Grammar Room,Grammar Room,Grammar Room,Grammar Room,Grammar Room,Grammar room,Growing minds  4,Growing Minds 3,Growing Minds 5,New Brain Booster,New Brain Booster,Science Alive,Simple grammar and compositions,Social studies,Social Studies,Understandind Mathematics 5"
Acevision Publisher Pvt. Ltd.,43,"Aao vyakaran shikhe 5,Aao vyakaran shikhe 6,Aao vyakaran shikhe 7,Aao vyakaran shikhe 8,An insight into social science 5,An Insight Into Social Studies,An insight into social studies 5,An insight into social studies 5,Brain Booster plus,Brain booster plus,Brain booster plus,Brain Booster Plus 3,Brain booster plus 4,Brain booster plus 5,Brain Booster plus 5,Brain booster plus 6,Brain Booster plus 6,Brain Booster plus 7,Brain Booster plus 7,Brain Booster Plus 7,Brain booster plus 8,Brain Booster plus 8,Busy bees hindi pathamala: class 2,Busy bees hindi pathamala: class 3,Busy bees hindi pathamala: class 4,Busy bees hindi pathamala: class 5,Busy bees hindi pathamala: class 6,Busy bees hindi pathamala: class 7,Busy bees hindi pathamala: class 8,Inspiring souls : book of moral values and life skills,Inspiring souls : book of moral values and life skills 2,Inspiring souls : book of moral values and life skills 6,Inspiring souls : moral values ad life skills,Inspiring souls : moral values and life skills 1,Inspiring"
add,8,"Creative kids, Fun, learn,Explor new horizons of Art and craft,Creative kids, Fun, learn,Explor new horizons of Art and craft,Golen Gate : English for schools,I World : A course book of computer science and information Technology,Reasoning and Aptitude 6,The Joy of Science: A text book of Science and technology,The master key to riches,The Science Times"
Addone Publishing Group,1,King''s English: Grammar composition vocabulary Spoken english
Advaita Ashrama,1,The complete works of Swami Vivekananda
Advita Ashram,2,"Complete works of Swami Vivekananda, Vol-2,My idea of education"
AIETS.Com Pvt.Ltd,1,Student workbook: Mathematics
Alka Publication,1,World famous personality
All India Educational Testing Service,3,"Science,Science,Social Science"
Allied Chamers Ltd.,3,"Junior School Dictionary,Junior School Dictionary,Junior School Dictionary"
"Allied Publishers Pvt, Ltd.",33,"Advanced Rediant Readers,Advanced Rediant Readers,Advanced Rediant Readers,Advanced Rediant Readers,CCE wonders of Science,CCE wonders of Science,Computer  wizard,Computer wizard,Computer wizard,Computer wizard,Computer wizard,Core Mathematics,Core Mathematics,Core Mathematics,Facts for Fun : General knowledge,Geography,Grammar World: Bringing the world into grammar class,Green Meadows,Green Meadows English Reader,GREEN MEADOWS ENGLISH READER,GREEN MEADOWS English Reader,Green Meadows English Reader,Living Values,Mel Jol Explorers,New Primary Science,New Radiant Core Mathematics,New Rediant Science: An Integrated Approach,Our Wonderful World of Social Studies,Our Wonderful World of Social Studies,Our Wonderful World of Social Studies,Rediant Readers,Rediant Readers,Understanding History & Civics"
Amanda Imprient,5,"Connect with Grammar and Composition,Grammar and Composition,Interactice science 8,Interactive science 7,Shakshi hindi pathmala 6"
Amanda Imprint,7,"Academic Science,Activities in Mathematics,Grammar and Composition,Grammar and Composition,Multiple choice Questions in Science,Multiple choice Questions in Social Science,Science Term 1"
Amanda Imprint & Laxmi Publications,5,"Connect with Grammar,Connect With Grammar And Composition,Connect With Grammar And Composition,Map work Social Science,Sakshi : pathmala 5"
Amar Chitra Katha,199," Jagadis chandra bose,3 in 1 Champions of change,3 in 1 Maratha bravehearts,3 in 1 Tales from the desert,3 in 1 The sons of the pandavas,3 in 1 Vishnu the saviour,A nation awakes: the march to freedom,Abhimanyu: star crossed prince,Agastya: Renowned among the saptarshi,Akbar : a visionary monarch,Amar singh Rathor: of Rajput pride and honour,Anant Pai:master storyteller,Andhaka: the dark lord who saw light,Angulimala: the bandit who took refuge in Buddha,Aruni and uttanka: tales of devotion and reward,Ashoka and Chandragupta:2 in 1 mega stories,Ashoka: the warrior who spoke of peace,Ashwini kumars: tales of devotion from the Veda,Bagha Jatin :the tiger  revolutionary,Bahubali: he gave up his empire to learn the truth,Baji Rao 1: the warrior peshwa,Banda Bahadur: a valliant sikh warrior,Beni madho and pir ali: heroes of 1857,Bhagat singh: the cheerful young martyr,Bhagatsinh and Chandra Shekhar Azad,Bheem and Hanuman :the sons of vayu,the wind god,Bimbisara: model king of Magadha,Birbal the clever : tales of b"
Amazing reads,1,Think and grow rich
Amit Prakashan,41,"Brain Game 3,Brain Game 4,Brain Game 5,Brain game 6,Brain Game 7,Brain Game 8,Brain Game General Knowledge & I.Q. Test,Communicative English Activity,Essential of mathematics,Essential of mathematics,Essentials of mathematics,Essentials of mathematics,Gyan-vatika : pathyapustak 5,Gyan-vatika : pathyapustak 5,Joy of Arithmetic,Learn english Grammar,Learning Computer,Learning Computer,Learning Computer,Learning Computer,Learning Computer,Learning Computer,Learning Computer,Learning Computer,Learning Computer,Learning Computer,Learning Science and Technology,Live and let live,My Big book od social Studies,My book of Social Studies,My Book of Social Studies,My book of Social Studies,My book of Social studies,My book of Social studies,My book of social studies: class 5,Our Environmen Environmental Studies,Our Environment,Our Environment:  Environment Studies,Science and technology,Science and Technplogy,The Japanese Art of Paper Folding Folding Touch : With Colour Sheet"
Amity University Press,42,"Amrit : pathmala 5,Amrit : pathmala 6,Amrit Hindi Pathyapustak,Amrut hindi pathmala,Amrut hindi pathmala,Amrut hindi pathmala 3,Amrut hindi pathmala: class 1,Amrut hindi pathmala: class 2,Amrut hindi pathmala: class 3,Amrut hindi pathmala: class 4,Amrut hindi pathmala: class 5,Amrut hindi pathmala: class 6,Amrut hindi pathmala: class 7,Amrut hindi pathmala: class 8,Cinderella,English Grammar,English Grammar,English Grammar 7,English Worksheet,English Worksheets,Grow with numbers 5,Grow with values 7,Grow with values 8,Grow with values 8,Grow with words : coursebook 8,Learn english grammar skill with thrills: class 1,Learn english grammar skill with thrills: class 2,Learn english grammar skill with thrills: class 3,Live and let live,Live and let live 1,Live and let live 2,Live and let live 3,Live and let live 3,Live and let live 4,Live and let live 4,Live and let live 4,Live and let live 5,Mathematics 6,Mathematics 7,Mathematics 8,Wonderful numbers 5,Wonderful words :english coursebook"
Amruta Prakashan,7,"Pallav hindi pathypustak: class 2,Pallav hindi pathypustak: class 3,Pallav hindi pathypustak: class 4,Pallav hindi pathypustak: class 5,Pallav hindi pathypustak: class 6,Pallav hindi pathypustak: class 7,Pallav hindi pathypustak: class 8"
Anderson press ltd,2,"The pets you get !,Who's in the Loo ?"
Anzella publication (a product of ACE ppublishing),10,"Dimensions :a textbook of social studies 7,Dimesions : a textbook of social studies 6,Essence of grammar 6,Essence of grammar 7,Essence of grammar 8,Growing minds 6,Growing minds 7,Understanding Mathematics  6,Understanding Mathematics 7,Understanding Mathematics 8"
Arihant,12,"10 sample question paper cbse exam 2016: sanskrit, term 2, class 10,15 Sample papers english communicative,15 sample papers Mathematics,15 sample question papers science,15 Sample question papers science class 10,15 Sample question papers social science class 10,All in one social science,All in one social science,All in one Social science  term -1,General Knowedge 2018,General Knowledge 2018,NTSE"
Arihant Prakashan,53,"10 sample question papers english communicative: term 2, class 9,10 sample question papers foundation of information technology: term 2, class 9,10 sample question papers mathematics: term 2, class 9,10 sample question papers science: term 2, class 9,10 sample question papers social science: term 2, class 9,15 sample question papers in Accountancy, class 12,37 years chapterwise topicwise solved paper 2015 IIT JEE  |Mathematics,Algebra,All in one : Mathematics,All in one Hindi B, Term 1,All in one: complete study resource  in English core, class 12,Business Studies,Canterville ghost,Canterville ghost,CBSE chapterwise solved paepers 2008-2015: Chemistry, class 12,CBSE chapterwise solved paepers 2008-2015: Mathematics, class 12,CBSE chapterwise solved paepers 2008-2015: Physics, class 12,Complete sucess package for online BITSAT 2013,Coordinate geometry,Diary of a young girl,Diary of a young girl,Term, 1 &-2,Differential calculus,Differential calculus,Essential physical chemistry,Gullver''s Travels,Integral Calc"
"Arihant Prakashan ,",11,"12 years'' CBSE AIPMT solved papers 2014-2003,CBSE AIPMT Physics: 27 years'' chepterwise solution,CBSE chapterwise solution biology,CBSE chapterwise solution chemistry,CBSE chapterwise solution mathematics,CBSE chapterwise solution physics,Chemistry: question Bank Class 12,Master resource book in chemistry JEE main,Mathematics for engineering entrance 2014-2003,New patter physics: master practice book for JEE main and advanced,Physics: question Bank Class 12"
Arihant Publication,4,"All in one social science, term2,Chapterwise solved paper in Computer Science,General Knowledge 2017,General Knowledge 2017"
Arrow books,16,"A case of need,Airframe,Carry on jeeves,Jurassic Park,Leave it to Psmith,Mind Quest 3,Mind Quest 5,Piccadilly Jim,The code of the woosters,The right path 1,The right path 7,The wit and wisdom of P.S.Wodehouse,Think beyond 7,Think beyond life skills 8,Timeline,Uncle fred in springtime"
Arrow Publication Pvt. Ltd.,41,"Active Grammar,Active Grammar,Active Grammar,Active Grammar,Active Grammar,Active Mathematics,Active Social Studies,Arrow Environmental Studies,Arrow Mouse : The computer book,ENGLISH CONVERSATION FOR YOU,English conversation for you,English conversation for you,English conversation for you,English conversation for you,Environmental Studies,Grammar treasure 6,Grammar Treasure 8,I can ! 1,I can! value education 5,Maths World,Maths World,Maths World,Maths World,Maths World 5,Mind Quest 4,Mind quest 6,Mouse : The computer book,Mouse The Computer Book,Mouse: The Computer Book,Mouse: The Computer book,Mouse: The Computer Book,Mr. Know All : General Knowledge,Mr. Know All GK.,Mr. Know All GK.,Perfect Grammar for effective Communication,Perfect Grammar For Effective Communication,Social Studies,The right path,The right path 3,Think beyond 1,Think beyond 10"
Arrow Publications Pvt. Ltd.,14,"English conversation for you,English conversation for you,English conversation for you,English conversation for you,Grammar treasure 7,Maths world,Mind quest 7,Panorama: skill based approach to english language learning, class 1,Panorama: skill based approach to english language learning, class 2,Panorama: skill based approach to english language learning, workbook, class 1,Panorama: skill based approach to english language learning, workbook, class 2,Panorama: skill based approach to english language learning, workbook, class 4,Perfect Grammar For Effective Communication,Perfect Grammar For Effective Communication"
Arya Book Depot,144,"ABD''S Accountancy,ABD''S Accountancy,ABD's Accountancy Financial Accounting II,ABD's Accountancy financial vol 1   11,ABD's Accountancy vol 1,ABD's Bull's eye business studies 12 term1,ABD'S Interactive English,ABD's Questions for Revision in Mathematics 11,Accontancy,Accountancy,Accountancy : Accountiong for not profit organisations partnership firms and companies,Accountancy 12 part -A vol-1,Accountancy 12 part 1,Accountancy 12 part A vol 2,Accountancy part A 12,Accountancy Part A Vol 2,Accountancy part A volume I,Accountancy part A volume II,Accountancy Part-A Volume-II,Accountancy partA VOL.1,Accountancy vol 2: financial accounting II,Accountancy vol II with Goods and service tax,Accountancy volume 1 financial accounting 1,Accountancy Volume-1 Part-A,Accountancy: Accounting for partnership firms and companies,Accountancy: Accounting for partnership firms and companies,Accountancy:accounting for companiesand not for profit organisations part A,Accounting,Analysis of financial statements,Analysis of financ"
Arya Publicatioin Company,36,"Composite science,Drill excercises in mathematics,Drill excercises in mathematics,Drill excercises in mathematics,Drill excercises in mathematics,Drill excercises in mathematics,Drill excercises in mathematics,Drill exercises in mathematics 5,Indian economic development 12,Indian Economic Development 12,Katha Sangam 5,Laboratory manual mathemetics-Revised according to national carriculam fremework prepared by NCERT,Laboratory manual mathemetics-Revised according to national carriculam fremework prepared by NCERT,Laboratory manual mathemetics-Revised according to national carriculam fremework prepared by NCERT,Macro economics 12,Perfect compisite mathematics; CCE enalbled including value based questions,Perfect compisite mathematics; CCE enalbled including value based questions,Perfect compisite mathematics; CCE enalbled including value based questions,Perfect compisite mathematics; CCE enalbled including value based questions,Perfect compisite mathematics; CCE enalbled including value based questions,Perfect "
Arya Publication,63,"Bright Sparks : A book of General Knowledge,Bright Sparks: A book of General Knowledge,Canterville ghost,Composite Mathematics,Composite Mathematics,Composite Science,Composite Science for us,Composite Social Sciences,Computer,Computer world,Digest English Communicative,Drill Exercises in Mathematics,Drill Exercises in Mathematics,Foundation of Information technology,Gulliver Travels: Jonathan Swift,Gulliver Travels: Jonathan Swift,Gullver''s Travels,Gullver''s Travels: Jonathan swift Term 1-2,History,Invisible man: H.G. Wells,Laboratory Manual Mathematics,Laboratory Manual Mathematics,Laboratory Manual Mathematics,Laboratory manual physics,Laboratory Manual Science,Laboratory Manual Science: Including MCQ to test the Practicle Skills,Learning Mathematics, class 9,Mathematics: Laboratory Manual,MCQ on Practicle skills in Science,Our Social Panorama Social Studies,Resoueces and Development Geography,Sanskrit Sandarshika,Sanskrit Sandarshika,Secondary Biology: first and second,Secondary Biology: first and secon"
Arya Publications,24,"Accountancy 11,Accountancy part A Vol 1,Accountancy part A VOL 2,Accountancy part A vol.1,Analysis of financial statements part B 12,Foundation of information Technology 9,Indian Economic Development 12,Introductory macroeconomics 12,Introductory Micro and Macro economics,Mathematics,Mathematics,Mentor in business studies 11,Perfect 15 sample papers  Mathematics 12,Perfect social science 6,Practice questions in mathematics 7,Social Science 6,Social science 7,Social Science 8,Statistics for economics 11,Suno kahani 2,Suno kahani 3,Suno Kahani 4,Suno Kahani 5,Suno kahaniya 8"
Arya Publishig Company,31,"`Katha Sangam 4,Apna vyakaran 7,Apna vyakaran 8,Business studies,Business studies 12,Business studies 12,Composite mathematics for us,Composite Science for us,Computer Science,Drill Exercises in Mathematics,Katha Sangam 1,Katha Sangam 3,Katha Sangam 3,Katha Sangam 4,Laboratory manual Mathematics,Laboratory manual: Mathematics,Laboratory manual: Mathematics,Laboratory manual: Science,Laboratory manual: Science,Leboratory  Manual Mathematics,Let''s Grow with Composite Mathematics,Our Environment Geography,Our Social Panorama,Perfect Problem solving Assessment,Perfect Problem solving Assessment,Sankalpam 6,Self Help Composite Mathematics,Social and Political Life,Suno Kahani  5,Suno kahani 6,Vyakaran Sopan 9"
Arya Publishing Company,50,"Abhayash pustika rimzim: class 2,Abhayash pustika rimzim: class 4,Abhayash pustika rimzim: class 5,Abhayash pustika ruchira prathamo  bhag: class 6,Abhayash pustika ruchira prathamo  bhag: class 8,Abhayash pustika vasant: class 6,Abhayash pustika vasant: class 7,Abhayash pustika vasant: class 8,Accountancy: accounting for partnership firms, part A, vol 1, class 12,Analysis of financial statements: part B, class 12,Apna vyakaran 6,Business studies: with application, HOTS and evalution based questions including case studies, class 12,Computer applications 9,Drill exercises in mathematics 5,Drill exercises in mathematics: class 6,Drill exercises in mathematics: class 7,Drill exercises in mathematics: class 8,Introductory macroeconomics: including multiple choice and value based questions, class 12,Introductory microeconomics: including multiple choice and value based questions, class 12,Katha Sangam 2,Katha Sangam 5,Laboratory manual mathematics: class 10,Laboratory manual mathematics: class 9,New perfect compos"
Arya Publishing Copany,33,"Accountancy,Accountancy part A : Class 12,Business studies,Business studies,English communicative: Perfect sample papers, SA-1, Term-1,English communicative: Perfect sample papers, SA-1, Term-1,English communicative: Perfect sample papers, SA-1, Term-1,Full Marks Social Science,Hindi  : Perfect sample papers, SA-1, Term-1,Hindi: Perfect sample papers- Course B , SA-1, Term-1,Hindi: Perfect sample papers- Course B , SA-1, Term-1,Hindi: Perfect sample papers- Course B , SA-1, Term-1,Hindi: Perfect sample papers- Course B , SA-1, Term-1,Indian conomic Development,Mathematics : Perfect sample papers, SA-1, Term-1,Mathematics : Perfect sample papers, SA-1, Term-1,Mathematics: Hints&  solutions,Mathematics: Perfect sample papers, SA-1, Term-1,Mathematics: Perfect sample papers, SA-1, Term-1,Mathematics: Perfect sample papers, SA-1, Term-1,Mathematics: Perfect sample papers, SA-1, Term-1,Mathematics:value base questions,Problems & solutiona in accountancy,Science : Perfect sample papers, SA-1, Term-1,Science : Perfe"
Ashlar education consultants pvt ltd,8,"Igniting life 1,Igniting life 2,Igniting Life 3,Igniting life 4,Igniting life 5,Igniting life 6,Igniting life 7,Igniting life 8"
Asia Book House,32,"Advanced computer- how,Advanced computer- how,Advanced computer- how,Advanced computer- how,Begineer''s Social Studies : Introductory,Begineers Computer Science,Beginner''s Computer Science,Beginner''s Mathematics,Beginner''s Social studies,Beginner''s Social Studies,Beginners Computer Science,Beginners Social Studies,Computer Science,Knowledge wave 8,Knowledge waves,Knowledge waves 5,Knowledge waves 6,Knowledge waves 7,Literature reader,Maths refresher,Maths refresher,Maths refresher,New Blossom for the yong,Science refresher,Social science refresher,The torchbearer : a guide to good living 4,The torchbearer 3,The torchbearer 8,Torchbearer: guide to good living,Torchbearer: guide to good living,Torchbearer: guide to good living,Young Explorer"
Asia Book House Educational publishers,9,"Advanced All in one,Beginner''s  Social Studies,English Wizard,Integrated Mathematics,Nature my teacher,New Blossom Composite Mathematics,Social Studies for the young,Young Explorer,Young Scientist"
Avichal Publishing Company,77,"A better you,A Better You : A book on value education and life skills,A Better You : A book on value education and life skills,A Better You : A book on value education and life skills,A better you 1,A better you 2,A better you 3,A better you 4,Accountancy , Part-A,Accountancy , Part-B,Accountancy 11,An Activity based learning process in Science,An Activity based learning process in Science,An Activity Based Learning Process In Science,Basic health and physical education,Basic health and physical education,Basic health and physical education,Basic health and physical education,Business studies,Computer applications 10,Diary of a young girl,Discovery science,English Grammar and Composition,English Grammar and Composition,English Grammar and Composition,English grammar and compositon,English grammar and compositon,English grammar and compositon,Graded English Grammar 7,Graded English Grammar and Composition,Graded English Grammar and Composition,Graded English Grammar and Composition,Graded english grammar and c"
Award publications limited,17,"Aladdin and his wonderful lamp,Bicycle magic and other stories,Famous five go adventuring again,Five on Brexit Island,Hello Mr.Twiddle!,Look out for the elephant and other stories,Secret seven :secret seven win through,Snow White and the seven Dwarfs,The adventures of Mr.Pink whistle,The fairies shoemaker and other stories,The flyaway money and other stories,The Goblin Hat and other stories,The little brown bear and other stories,The little Toy engine and other stories,The ugly old scarecrow and other stories,Those dreadful children,Twelve silver cups and other stories"
Balvinod publication,20,"Fairy Tales,Folk tales of west bengal,Gulliver's travel,Gulliver's travels,Hansel and gretel,Ramayana for children part 1,Ramayana for children part 2,The coward prince,The coward prince,The gita,The magic mare,The magic mare,The magical Lamp,The magical lamp,The magical turtle,The magical turtle,The mystery seven layers,The mystery through  sven layers,The sincere doctor,The sincere doctor"
Bantam press,1,The grand design
Bharti Bhavan publisers & distributors,72,"Basic Science 6,Basic Science 6,Basic science 7,Basic Science 8,Basic Science 8,Basic science 8,Biology,Bright hearts 1,Bright hearts 1,Bright hearts 2,Bright hearts 3,Bright hearts 3,Bright hearts 4,Bright hearts 4,Bright hearts 5,Bright hearts 6,Bright hearts 7,Bright Hearts 8,Foundation science chemistry,Foundation science chemistry 10,Foundation science physics 10,Hands on maths 6,Hands-on maths 7,Hands-on maths 8,Hindi reader 3,Hindi reader 5,History And Civics,History And Civics,History And Civics,Junior knowledge 3,Junior Knowledge 3,Junior Knowledge 5,Junior knowledge 5,Junior maths 5,Junior maths 5,Junior World,Junior world 5,Knowledge +,knowledge +,Knowledge +,Knowledge +,Knowledge +,Knowledge +,Knowledge + 7,knowledge 6,kNOWLEDGE 8,Mathematics 10,Mathematics 10,Mathematics 6,Mathematics 6,Mathematics 6,Mathematics 6,Mathematics 6,Mathematics 7,Mathematics 7,Mathematics 7,Mathematics 8,Mathematics 8,Our World Then And Now,Our world then and now 6,Our world then and now 7,Our world then and now 7,Our"
Bharti Bhavan Publisher,1,"Reactions, rearrangements  and reagents"
Bharti Bhavan Publishers,26,"Core Chemistry, class 12,Foundation science  Biology,Foundation science  Biology,Foundation science  Biology,Foundation Science : chemistry,Foundation Science Biology, 9th standard,Foundation science Chemistry,Foundation science Chemistry,Foundation science Chemistry,  9th standard,Foundation science Physics,Foundation science Physics,Foundation science Physics,Foundation science Physics,  9th standard,Foundation Science: Biology,Junio maths,Junio maths,Junio maths,Junio maths,Junio maths,Mathematics,Mathematics,Mathematics,Modern approach to physical chemistry: application of the concept of equilibrium 1, class 12,Secondary  school Mathematics, 9th standard,Secondary school mathematics,Secondary School Mathematics"
Bharti Bhawan,18,"Concept of Physics 1, class 12,Foundation science  Chemistry,10th standard,Foundation science Biology, 10th standard,Foundation science Physics,10th standard,Hands on Maths,Hands-on Maths,Hands-on Maths,Junior Maths,Mathematics,Mathematics,Mathematics,Mathematics,Maths Steps,Modern approach to chemical calculations: an introducation to the modern concept,My World,Our World then now,Problems plus in IIT Mathematics,Secondary school Mathematics,10th standard"
Bharti Bhawan P & D,8,"Junior Maths, class 3,Junior Maths, class 4,Junior Maths, class 5,Junior Maths: class 2,Senior secondary school mathematics: class 10,Senior secondary school mathematics: class 11,Summore maths practice and activities: class 2,Summore maths practice and activities: class 5"
Bharti Bhawan Publisers & Distributers,6,"Mathematics,class 6,Mathematics,class 6,Mathematics,class 7,Mathematics,class 7,Mathematics,class 7,The magic carpet :coursebook 6"
