PUBLISHER,TOTAL BOOKS,BOOK TITLES
Madhuban Educational Books,59,"`New voices 8,Bato ki phulvari : sahayak pushtakmala,CCE made simple Hindi A,Term-2,CCE made simple Hindi A,Term-2,CCE made simple Hindi A,Term-2,English  marvel: Coursebook,Garima : pathmala 5,Garima : pathmala 5,Garima hindi pathmala 7,Garima hindi pathmala 7,Garima hindi pathmala 7,Garima supprot book,class 1,Garima supprot book,class 2,Garima supprot book,class 3,Garima supprot book,class 4,Garima supprot book,class 5,Garima supprot book,class 6,Garima supprot book,class 7,Garima supprot book,class 8,Garima:text-cum-workbook, class 1,Garima:text-cum-workbook, class 2,Garima:text-cum-workbook, class 3,Garima:text-cum-workbook, class 4,Garima:text-cum-workbook, class 5,Garima:text-cum-workbook, class 6,Garima:text-cum-workbook, class 7,Garima:text-cum-workbook, class 8,Good to know,Hindi-A- worksheets and assignments-,How ? What ?Why ? : My book of General Knowledge,Joyride 6,Joyride gk 3,Let''s Try?.. Value- Based Education,Madhup hindi pathmala 8,Madhup hindi pathmala 8,Maths Mate 5,Maths Mate 6,My Englis"
Madhuban Publication,1,Utkarsh Textbok
Madhubun,28,"A Practical Course in Interactive English Grammar for effective communication,GK joyride 7,GK Joyride 8,Joyride 3,Madhup Hindi Pathmala,Madhup Hindi Pathmala,My english garden: a constructivist approach to language learning, class 1,My english garden: a constructivist approach to language learning, class 2,My english garden: a constructivist approach to language learning, class 5,My english garden: a constructivist approach to language learning, class 8,vyakaran sambodha: class 4,vyakaran sambodha: class 5,Vyakran sambodh: teachers support book: class 1,Vyakran sambodh: teachers support book: class 1,Vyakran sambodh: teachers support book: class 2,Vyakran sambodh: teachers support book: class 2,Vyakran sambodh: teachers support book: class 3,Vyakran sambodh: teachers support book: class 3,Vyakran sambodh: teachers support book: class 4,Vyakran sambodh: teachers support book: class 4,Vyakran sambodh: teachers support book: class 5,Vyakran sambodh: teachers support book: class 5,Vyakran sambodh: teachers suppor"
Madhubun Educational Books,75,"Continuous and comprehensive Evalution made simple : Mathematics,Environment: Environmental Studies,Fun with Colours and Crafts,Grammar Magic,Grammar Magic,Grammar Magic 7,Head start Science,Headstart Science,Headstart Science,Headstart Science,How ? What ?Why ? : My book of General Knowledge,How to draw & Color,How to Draw & Colour -2,How? What? Why? My Book Of General Knowledge,Knowledge Hunt Gk.,Knowledge Hunt Gk.,Knowledge Hunt: General Knowledge,Knowledge Hunt: General Knowledge,Knowledge Hunt: General Knowledge,Knowledge Hunt: General Knowledge,Knowledge Hunt: General Knowledge,Life Skill and Value,Life Skill and values,Life skills and Values,Log on  to computer,Log on to Computer,Log on to Computers,Log on to Computers,Lon On To computers,Made sample English Communicative,Made sample Social science,Mile stone: History,Mile stone: Social science History Geography Social and Political Life,Milestone Social Science:  History, Geography, Social and political life,Milestone Social Science:  History, Geograp"
Magna publishing co ltd,1,See you at the top
Mahayog foundation,1,Mahayog yoga academia
Malhotra Book Depot,54,"Accoubtancy CBSE question bank chapterwise,Biology CBSE Question bank,Business Studies CBSE question bank chapterwise 12,CBSE Question Bank Business studies term II,CBSE Question Bank Economics,CBSE Question Bank social science term 2,CBSE Question Bank term 2 Accountancy,CBSE Sample papers Accountancy 12 for 2020 exam,CBSE Sample papers English : for 2020 exam,CBSE Term 2 Mathematics 12,Chemistry CBSE question bank,Economics CBSE question bank chapterwise,English CBSE question bank,English CBSE Question bank,English language and literature 10,English language and literature 9,Hindi CBSE question bank,Mathematics: Super Refresher 9,Mathematics:CBSE Question bank chapterwise  10,Maths CBSE question bank,physics CBSE question bank,Problem solving assessment- guide,Problem solving assessment- guide,Question bank  science 10,Question bank physics 12,Sample papers Economics 12: for 2020exams,Sample papers mathematics 10,Sample papers Science,Sample papers solved: Accountancy,Sample papers solved: Biology,Sample pa"
Manipal academy of higher education,1,E-Business Fundamentals
Manjul Publishing House,1,Secret
Manoj Poket Books,2,"Aayurvedik Chikista Sar,Sampurna Chanakyasutra"
Manoj Publication,4,"Arebian nights,Hitopdesh,Puss in Boots,The sleeping beauty"
Mapin Publishing,1,Handloom and handicraft of Gujarat
Maple press,7,"Anandmath (Hindi),Devi chhodhrani (Hindi),Kafan,Kankaal (Hindi),Karambhumi (Hindi),Pratigya (hindi),The mill on the floss"
Marina publications,9,"Heart and mind 1,Heart and mind 3,Heart and mind 4,Heart and mind 6,Heart and mind 8,Insirations for life,Inspirations for life 1,Inspirations for life 7,Inspirations for life 8"
Mascot Learning Hub Private Limited,11,"Grammar hive :grammar and composition 7,Grammar Hive 6,I want to know : book of general knowledge 8,I want to know :general knowledge,I want to know 5,I want to know general knowledge 4,I want to know general knowledge 6,I want to know general knowledge 7,Science Route 6,Science Route 7,Science Route 8"
Mayur Publication,3,"Raise the Knowledge,Raise the Knowledge,The way to Happiness"
McLearners publications,6,"English grammar 8,Exploring knowledge 6,Exploring knowledge 7,Exploring knowledge 8,Mclearners english grammar 6,Mclearners english grammar 7"
MD Books International,2,"Knowledge world 5,My big knowledge encyclopedia"
Millennium booksource private ltd,30,"Millennium Science,Millennium science 6,Millennium's science 6,Milligascar :know the world around you 4,Milligascar 6,Milligascar 6,Milligascar 8,Milligascar know the world around us 8,Milligascar know the world around you,Milligascar know the world around you 3,Milligascar know the world around you 5,Milligascar: know the world around us 7,My green world 5,My green world 5,Now ,I know it 4,Now I know it 3,Now I know it 4,Now I know it 5,Now I know it 5,Science 7,Science 8,Science millennium,Social science,Social science : workbook  6,Social science 6,Social science 6,Social science 7,Social science 7,Social science workbook 7,Social studies 5"
Mittsure technologies,1,Moral Values 1
Modern Publisher,20,"Modern abc of Chemistry part  2, class 11,Modern abc of Chemistry part 1, class 11,Modern''s abc of biology: part 1, class 11,Modern''s abc of biology: part 1, class 12,Modern''s abc of biology: part 2, class 11,Modern''s abc of biology: part 2, class 12,Modern''s abc of chemistry, part 1, class 11,Modern''s abc of chemistry, part 1, class 12,Modern''s abc of chemistry, part 2, class 11,Modern''s abc of chemistry, part 2, class 12,Modern's ABC Mathematics 10,Modern's ABC Mathematics 9,Moderns abc mathematics: part 1, class 11,Moderns abc mathematics: part 1, class 12,Moderns abc mathematics: part 2, class 11,Moderns abc mathematics: part 2, class 12,Moderns abc of physics: part 1, class 11,Moderns abc of physics: part 1, class 12,Moderns abc of physics: part 2, class 11,Moderns abc of physics: part 2, class 12"
Modern Publishers,21,"ABC of Biology: Lab Manual,Abc of laboratory manual in Biology,ABC of Mathematics,Abc of Physics Part-1,Abc of Physics Part-2,ABC of Physics: Lab manual,Abc of Practical Biology,Modern abc of chemistry part,1,modern abc of chemistry-Part-1,modern abc of chemistry-Part-2,modern abc of chemistry-Part-2,Modern''s abc biology, Part 1,Modern''s abc biology, Part 1,Modern''s abc of Biology part 1,Modern''s abc of Biology part 2,Modern''s abc of Chemistry part 1,Modern''s abc of Chemistry part 2,Modern''s abc of Mathematics part- 1,Modern''s abc of Mathematics part- 2,Modern''s abc of Physics part - 1,Modern''s abc of Physics part - 2"
Monaco,2,"Book of nature,World heritage : 911 cultural and natural heritage monuments selected by UNESCO"
MTG Books,12,"100 percent biology 11,100 percent biology 12,100 percent chemistry 11,100 percent mathematics 11,100 percent mathematics 12,100 percent mathematics CBSE,100 percent physics 11,100 percent physics 12,100 percent science  9,AIEEE explorer, class 12,Excel in chemistry,Learning mathematics  5"
National Council of Educational Research and Training,8,"FLamingo 12,Introductory Microeconomics,Introductory Microeconomics,Physics,Physics : Text book Part-1,Physics : Text book Part-2,Textbook for Physics Part-1,Textbook for Physics Part-1"
National Institute of Security Markets,2,"Student''s guide to  money : important life skills taught using 8 interactive modules in saving, budgeting,  financial planning and investing,Student''s guide to  money : important life skills taught using 8 interactive modules in saving, budgeting,  financial planning and investing"
Navajivan publishing house,1,An autobiography:the story of my experiments with truth
Navdeep Publication,13,"Comp Act : Learning Computeers through activities,Comp Act : Learning Computer through Activities,Compact : learning computer through activites,CompAct : learning Computers through activities,CompACt: Learning Computer Through Activities,Creasure of Knowledge : A book of general knowledge & I. T. test,Introduction to computer,Leisure learning Activity Books,My E V S,My E V S Book,Social Studies,Tresures of Knowledge,Vikas General Knowledge"
Navdeep Publications,7,"Elements,Gateway to windows,Gateway to windows,Gateway to windows,Gateway to windows,Ultimate in GK,Ultimate in GK"
Navneet Prakashan India Ltd.,62,"Anand hindi pathmala 3,Anand hindi pathmala 4,Anand hindi pathmala 5,Anand hindi pathmala 6,Anand hindi pathmala 7,Anand hindi pathmala 8,Elements : a coursebook of social studies 5,English stencil 5,English stencil 6,English stencil literature reader 3,English stencil literature reader 4,Gala''s Pocket Dictionary,General Knowledge,General Science,General Science,General Science,General Science,General Science,General Science,General Science: An Environmental Approach,Golden Grammar,Golden Grammar,Golden Mathematics,Grazoom Grammar,Grazoom Grammar Part 6,Interoduction to Computers,Introduction to Computer,Mathematics,Mathematics,Mathematics,New General Knowledge Course,Numerics : a coursebook of mathematics 6,Quest : book of general knowledge,Quest : book of general knowledge,Quest : book of general knowledge 8,Quest : general knowledge 7,Quest a book of GK,Quest general knowledge,Rangbirangi kahaniya,Rapid Revision Science and technology,Rise the grammar circle 6,Rise the grammar circle 7,Rise the grammar ci"
NCERT,99,"Accountancy: company accounts and analysis of financial statements, textbook for class 12,Accountancy: financial accounting, texbook for class 11, part 1,Accountancy: financial accounting, texbook for class 11, part 1,Accountancy: financial accounting, texbook for class 11, part 2,Accountancy: non for profit organisation and partnership accounts, texbook for class 12,An alien hand: supplementary reader in english for class 7,Bal mahabharat hindi ki purak pathypustak: class 7,Bal ramkatha hindi ki purak pathypustak: class 6,Bharat ki khoj hindi ki purak pathypustak: class8,Business studies: business finance and marketing, textbook in history for class 12, part 2,Business studies: principles and functions of management, textbook in history for class 12, part 1,Chemistry I :textbook for class 12,Chemistry part 1 class 11,Chemistry part 2 class 11,Chemistry part II :textbook for class 12,Contemporary India II: textbook in geography for class 10,Democrartic politics II: Textbook in political science for class 10,H"
Neeta Prakashan,1,Grazoom Grammar
New Age International,17,"English language and literature 9,Golden Hindi with sample papers- Course B,Golden Hindi with sample papers- Course B, Term 1& 2,Golden Hindi-Workbook, Term-1,Golden Sanskrit,Golden Sanskrit , class 10,Golden science with smple paper, term-2,Hindi workbook, term-1,Hindi workbook, term,2,Mathematics; a book with a difference 9,Muskaan 3,Science,Science 10,Science 10,Social Science  10,Social science 10,Social science 10"
New Age International P Ltd.,18,"Diary of a young girl, Term, 1 &-2,English Communicative with sample papers,English Communicative with sample papers,Gulliver''s travels,Hindi   10,Invisible man,Mathematics  with sample papers, term 1 &2,Mathematics  with sample papers, term 1 &2,Mathematics: with simple papers,Science,Science with sample paper,Term 1& 2,Science with sample paper,Term 1& 2,Science: With Sample Papers,Science: With Sample Papers,Silas marner,Social science with sample paper,Term 1& 2,Social science with sample paper,Term 1& 2,Story of my life"
New Age International P.Ltd,3,"English communivative,English communivative,Hindi   9"
New Age International P.Ltd.,10,"English language and literature,Mathematics : a Book with Difference,Science: A book with a Difference,Science: A book with a Difference,Science: A book with a Difference,Science: Assigment & Practicle Material,Science: Assignments & Practice Material,Science: Assignments & Practice Material,Silas Marner: George Eliot,The invisible Man"
New Age International Publishers,2,"Golden workbook social science: assignment and practice material: term 2, class 9,Muskan : pathmala 5"
New Saraswati House India Pvt. Ltd.,27,"Kalpataru hindi pathmala 3,Kalptaru : pathmala 5,Kalptaru : pathmala 6,Me "" n"" mine english communicative: pullout worksheets, term 1, class 10,Me "" n"" mine english communicative: pullout worksheets, with plenty of value based questions, term 2, class 10,Me "" n"" pullout worksheets english communicative: includes value based questions, term 2, class 10,Me aur mera vyakaran 5,Me aur mera vyakaran 7,Me aur mera vyakaran 8,Nayi Rangoli 5,Nayi Rangoli 7,Nayi Rangoli hindi pathaypushtak 6,Nayi Rangoli hindi pathaypushtak 8,Rangoli pathaypushtak 3,Rangoli pathaypushtak 4,Unmesh : pathyapustak 6,Unmesh hindi pathaypushtak 3,Unmesh hindi pathaypushtak 5,Unmesh hindi pathaypushtak 5,Unmesh hindi pathaypushtak 6,Unmesh hindi pathaypushtak 7,Unmesh hindi pathaypushtak 8,Unmesh hindi pathaypushtak 8,Unmesh hindi pathaypustak 3,Unmesh Hindi Pathyapustak,Unmesh pathaypushtak 4,Vyakaran darshika  9-10"
New Saraswati House Pvt. Ltd.,8,"Kalptaru hindi pathamala: class 1,Kalptaru hindi pathamala: class 2,Kalptaru hindi pathamala: class 3,Kalptaru hindi pathamala: class 4,Kalptaru hindi pathamala: class 5,Kalptaru hindi pathamala: class 6,Kalptaru hindi pathamala: class 7,Kalptaru hindi pathamala: class 8"
Newlee Publications,39,"`Science track 6,Grammar Crossing : A book of english grammar and composition,Green Earth EVS : A Book of Environmental Studies,Green Earth EVS : A Book of Environmental Studies,Green Earth EVS : A Book of Environmental Studies,I World,I world : A Course book of computer Science and Information Technology,I World : A Course Book of Computer Science and Information Technology,I World : A course book of computer science and information Technology,I World : A course book of computer science and information Technology,In pursuit of GK 8,Inpursuit of GK,Inpursuit of GK 5,Inpursuit of GK 5,Inpursuit of GK 7,Level Above Maths,Level Above Maths,Level Above Maths,Pankhuri 6,Pankhuri hindi pathaypushtak 7,Science Track,Science Track,Science Track,Science Track,Science Track,Science Track,Science Track,Science Track,Science track,Science Track 8,Suyasha : pathyapustak 5,Suyasha : pathyapustak 5,Suyasha : pathyapustak 6,Suyasha 5,Suyasha hindi pathaypushtak,Suyasha Hindi Pathyapustak,Suysha hindi pathypushtak 8,The Blue "
NewleePublications,2,"Domains of knowedge,Domains of knowedge"
Next books,9,"Next explorers EVS, class 2,Next general knowledge 5,Next general knowledge 6,Next generation knowledge,Value education,Value education 1,Value education 2,Value education 3,Value education 4"
"Nine Hats, Chetna Publication",39,"English 5,English 6,English integrated coursebook 7,English integrated coursebook 8,General science : integrated coursebook 7,General science 8,General science integrated course book,General science integrated course book,General science integrated course book,Grammar and Creative Writing,Grammar and Creative Writing,Grammar And Creative Writing,Grammar and Creative Writing,Grammar and Creative Writing,Grammar and Creative Writing,Grammar and Creative Writing 7,Hindi pathaypushtak  8,Hindi pathaypustak 3,Hindi pathaypustak 3,Mathematics : integrated coursebook 6,Mathematics 5,Mathematics coursebook 7,Mathematics integrated coursebook,Mathematics integrated coursebook,Mathematics integrated coursebook,Mathematics integrated coursebook,Nine hats : hindi pathyapustak 5,Nine hats : mathematics integrated coursebook 8,Nine hats hindi pathaypushtak 5,Reader 1,Reader For Sustained Silent Reading,Reader For Sustained Silent Reading,Reader For Sustained Silent Reading,Reader For Sustained Silent Reading,Reader For Sus"
Ocean Books P Ltd.,2,"Daisy and the Moon,Godhra: The Missing rage"
Octopus books Ltd.,1,Amaging Blunders and Bungiles
Octopus Publishing Group,1,Top ten of everything
Om books international,5,"365 fairy tales,365 folk tales,365 panchtantra stories,365 Science experiments,Gaban"
Omen Publishing House Pvt Ltd,9,"Frolic Grammar 6,Frolic grammar 7,Frolic grammar 8,Science 6,Science 7,Science 8,World of Social science 6,World of social sciences 7,World of social sciences 8"
Orange education pvt ltd,3,"Information technology  10,Information Technology 10,Information Technology 9"
Orchard,3,"As you like it: a shakespeare story,Henry V,Julius Caesar"
Orient BlackSwan,144,"ACE  english grammar and composition for schools 6,Ace english grammar 8,ACE english grammar and composition for schools,ACE english grammar and composition for schools 8,Anuraag hindi pathmala 3,Anuraag hindi pathmala 4,Canterville ghost,Canterville ghost: class 11,Dialogue 7,Dialogue Listening and speaking,Diary of a young girl, class 10,Diary of a young girl, class 10,Enjoying Grammar,Enjoying grammar,Enjoying grammar,Enjoying Grammar,Enjoying Grammar 7,Getting ahead in social science 6,Getting ahead in social science7,Grammar land 6,Grammar Land 7,Grammar land: class 5,Grammar land: class 6,Grammar land: class 7,Grammar land: class 8,Grammer land: class 3,Grammer land: class 4,Gulliver Travels: Into several remote nations of the world: class 9,Gulliver''s travels, class 9,Gulliver''s travels, class 9,Gulmohar :language for life,Gulmohar 6,Gulmohar 8,Gulmohar grammar and language skills 8,Gulmohar language for life,Junior english dictionary,Maths Ahead 5,Maths Ahead 5,Maths Ahead 7,Maths ahead CBSE: class "
Orient BlackSwan private ltd,21,"Grammar land 3,Grammar land 3,Grammar land 4,Grammar land 4,Grammar land 5,Grammar land 6,Grammar land 6,Grammar land 6,Grammar land 6,Grammar land 7,Grammar land 7,Grammar land 7,Grammar land 7,Raintree English :coursebook 6,Raintree English :coursebook 6,Raintree English :coursebook 6,Raintree English :coursebook 7,Raintree English :coursebook 7,Raintree English :coursebook 7,Raintree English :coursebook 8,Raintree English :coursebook 8"
Orient BlackSwan Pvt.Ltd,150,"Buzzword : Communicative English for schools,Buzzword: Communicative English for Schools,Buzzword: Communicative English for Schools,Computer Ahead,Computer Ahead,Computer ahead,Computer Ahead,Computer Ahead,Computer Ahead,Computer ahead,Computer ahead,Computer ahead,Computer Ahead,Computer Ahead,Computer Ahead,Computer Ahead : Information technology,Computer Ahead : Information technology,Computer Ahead : Information Technology,Computer Ahead: Information Technology,Computer Ahead: Information Technology,Computer vision,Computer Vision,Computer Vision,Computer Vision,Computer Vision,Computer Vision,Computers Ahead : Information Technology,Computers Ahead : Information Technology,Computers Ahead: Information technology,ComputersAhead : Information technology,Dialougue: A Speaking Listning Course for Cbse School,Dialougue: A Speaking Listning Course for Cbse School,Dialougue: A Speaking Listning Course for Cbse School,English Junction: A communicative course in english,English Junction: A communicative course "
Orient Longman,15,"GettingAhead in Social Studies,Golden Gate : English for schools,Golden Gate English For School,Golden Gate: English for Schools,Grammar Club,Grammar Club,Grammar Club,Knoledge Ahead GK.,Knowledge Ahead General knowledge,Maths Ahead 3rd edition,Maths Lab Activities,Maths lab Activities,One a week Spelling tests,Sangam with Gul Mohar: Mathematics,ScienceAhead Science & Technology"
Orient paperbacks,3,"Bye bye blackbird,The book of numbers,The joy of numbers"
Orion children's books,43,"A giant slice of Horrid Henry 3 books  in 1,A handful of Horrid Henry,A hat trick of Horrid Henry 3 books in 1,Don't be Horrid Henry,Horrid  Henry's monster movie,Horrid Henry,Horrid Henry : mighty joke book,Horrid Henry 's big bad book,Horrid Henry 's double dare,Horrid Henry and mummy's curse,Horrid Henry and the abominable snowman,Horrid henry and the Bogey babysitter,Horrid Henry and the comfy black chair,Horrid Henry and the football fiend,Horrid Henry and the mega mean time machine,Horrid Henry and the secret club,Horrid Henry And the zombie vanpire,Horrid Henry author visit,Horrid Henry gets rich quick,Horrid Henry joke book,Horrid Henry meets the queen,Horrid Henry robs the bank,Horrid Henry rules the world,Horrid Henry tricks the tooth fairy,Horrid Henry underpants,Horrid Henry wakes the dead,Horrid Henry's : stinkbomb,Horrid Henry's christmas cracker,Horrid Henry's christmas play,Horrid Henry's dreadful deeds,Horrid Henry's evil enemies,Horrid Henry's favourite jokes 3 books in 1,Horrid Henry's haun"
Oswaal Books,57,"CBSE 10 Sample question papers 10 science,CBSE 10 Sample question papers mathematics (standard),CBSE 10Sample question papers 10 computer applications,CBSE 10Sample question papers Social science,CBSE Question Bank - Social Science,English core chapterwise question bank 12,English core: question papers set 2016-17,Last minute preparation system 10,Last years solved papers 12,Last years solved papers in Commerce stream 2016-17, class 12,Last years solved papers in Humanities stream 2016-17, class 12,Last years solved papers in Science stream 2016-17, class 12,Mathematics Mcq chapterwise for term 1 and 2 10,MATHEMATICS QUESTION BANK,Mathematics: Question bank with Complete solution,NCERT Workbook 5,Open text based assessments, term - 2,Open text based assessments,term 2,class 9,Oswaal CBSE pullout worksheets in english communicative, 2017-18: class 10,Oswaal CBSE question bank with complete solutions: OTBA biology, class 11,Oswaal CBSE question bank with complete solutions: OTBA economics, class 12,Oswaal chapt"
Oswaal Publishers,1,"Most likely question papers set: english core, class 12"
Oxford University Press,139,"A practical english grammar,Arctic Adventure,Avenues : A Course on Developing english skill,Avenues : A Course on Developing english skill,Avenues : A Course on developing english Skills,Avenues : A course on developing English skills,Avenues : A course on developing English skills,Avenues : A course on developing English skills,Avenues: A Course on developing English Skills,Communicative English,Computer Science : Information Technology,Computer Science Information Technology,Computer Science: Information Technonology for Class 1,Discovering Mathematics,Discovering my self,Discovering My self : Value Education,Dolphin Rescue,Essays, Short Stories and one act plays,Floppy and the Bone,Foundation of Information technology,Frankenstein,General Knowledge,General Knowledge,Key Board : Computer Science with application Soft ware,KeyBoard : Computer Science: With Application Software,Keyboard Computer Science with Application Software,Keyboard Computer Science With Application Software,Keyboard Computer Science: Wi"
P.P.Publications,27,"Ashaye hindi pathaypustak 5,CBSE Secondary school Mathematics 10,CBSE Standard & Basic mathematics sample question paper,Mathematics 10,Mathematics 9,Mathematics 9,Maths Beyond 6,Maths Beyond 7,Maths Beyond 8,Maths bliss : textbook 7,Maths bliss 8,Nayi Ashaye hindi pathmala,Nayi Ashaye hindi pathmala,Panorama : a collection of short stories,Panorama : a collection of short stories 3,Panorama : a collection of short stories 4,Panorama collection of short stories,Panorama collection of short stories 2,Shanshipt Buddhcharitra,Shanshipt Mahabharat,Shanshipt Ramayan,World vision 3,World vision 4,World vision 5,World vision 6,World vision 7,World vision 8"
Pan books,5,"Be careful what you wish for,Cure,Harmful Intent,Heads you win,Only time will tell"
Parragon,19,"A brave beginning,A christmas carol,Alice in wonderland,Ancient world children encyclopedia,Animal encyclopedia,Animals of the world,Fantastic book of facts,Finding dory :an enchanting adventure,Finding dory n enchanting adventure,Goldilocks and three bears,Human body encyclopedia,Mighty machines: fascinating facts about the most powerful machines,My first encyclopedia:step inside and discover our world,My first picture encyclopedia,Oceans:the children encyclopedia,Our earth: the ultimate reference resource for the whole family, with over 500 photographs and illustrations,Stories to read,Wild world: the utimate guide to awesome animals,World Religion"
Parth Children Books Pvt.Ltd.,9,"English Grammar and Composition,Everyday Discoverry World,Everyday Discoverry World,Everyday Discovery World,Everyday Discovery World : A book of general knowledge,Everyday English Grammar and Composition,Everyday Social Studies,Everyday Social Studies,Social Studies"
Partridge,1,Indian Heritage quiz book 500 rare
Pavan Publisher,1,Science
Peal publishing House,1,A New Approach to Composite mathematics
Pearl India Publishing House Pvt. Ltd.,2,"Focus on Social Studies,V for Values: A New approach to value education"
